2026-02-13 03:14:33 - INFO - 
[Optuna] Starting hyperparameter search with 10 trials.
2026-02-13 03:14:33 - INFO - A new study created in memory with name: study_humanitarian9_hurricane_dorian_2019
2026-02-13 03:14:33 - INFO - Using devices: cuda, cuda
2026-02-13 03:14:33 - INFO - Devices: cuda, cuda
2026-02-13 03:14:33 - INFO - Starting log
2026-02-13 03:14:33 - INFO - Dataset: humanitarian9, Event: hurricane_dorian_2019, N: 25, Seed: 1234, HF Model: GPT-4o, NumShots: 25, PLM: bert-tweet
2026-02-13 03:14:34 - INFO - Learning Rate: 1.1711123256226357e-05
Weight Decay: 0.0023441093864910475
Batch Size: 8
No. Epochs: 10
Epoch Patience: 5
 Accumulation Steps: 8
2026-02-13 03:14:35 - INFO - Generating initial weights
2026-02-13 03:14:54 - INFO - Time taken for Epoch 1:17.66 - F1: 0.0629
2026-02-13 03:15:11 - INFO - Time taken for Epoch 2:17.51 - F1: 0.0690
2026-02-13 03:15:29 - INFO - Time taken for Epoch 3:17.53 - F1: 0.0760
2026-02-13 03:15:46 - INFO - Time taken for Epoch 4:17.51 - F1: 0.1057
2026-02-13 03:16:04 - INFO - Time taken for Epoch 5:17.54 - F1: 0.1244
2026-02-13 03:16:21 - INFO - Time taken for Epoch 6:17.54 - F1: 0.1324
2026-02-13 03:16:39 - INFO - Time taken for Epoch 7:17.51 - F1: 0.1539
2026-02-13 03:16:56 - INFO - Time taken for Epoch 8:17.52 - F1: 0.1734
2026-02-13 03:17:14 - INFO - Time taken for Epoch 9:17.55 - F1: 0.1878
2026-02-13 03:17:31 - INFO - Time taken for Epoch 10:17.55 - F1: 0.1984
2026-02-13 03:17:31 - INFO - Best F1:0.1984 - Best Epoch:10
2026-02-13 03:17:32 - INFO - Starting co-training
2026-02-13 03:17:57 - INFO - Time taken for Epoch 1: 24.37s - F1: 0.26332102
2026-02-13 03:18:22 - INFO - Time taken for Epoch 2: 24.92s - F1: 0.35924432
2026-02-13 03:18:47 - INFO - Time taken for Epoch 3: 25.19s - F1: 0.42318131
2026-02-13 03:19:12 - INFO - Time taken for Epoch 4: 25.00s - F1: 0.43665181
2026-02-13 03:19:37 - INFO - Time taken for Epoch 5: 25.07s - F1: 0.45717818
2026-02-13 03:20:02 - INFO - Time taken for Epoch 6: 25.12s - F1: 0.44882076
2026-02-13 03:20:26 - INFO - Time taken for Epoch 7: 24.34s - F1: 0.44603050
2026-02-13 03:20:51 - INFO - Time taken for Epoch 8: 24.29s - F1: 0.43933135
2026-02-13 03:21:15 - INFO - Time taken for Epoch 9: 24.33s - F1: 0.45914883
2026-02-13 03:21:40 - INFO - Time taken for Epoch 10: 24.95s - F1: 0.45075806
2026-02-13 03:21:42 - INFO - Fine-tuning models
2026-02-13 03:21:45 - INFO - Time taken for Epoch 1:3.35 - F1: 0.4575
2026-02-13 03:21:49 - INFO - Time taken for Epoch 2:3.93 - F1: 0.4599
2026-02-13 03:21:53 - INFO - Time taken for Epoch 3:3.94 - F1: 0.4582
2026-02-13 03:21:56 - INFO - Time taken for Epoch 4:3.35 - F1: 0.4700
2026-02-13 03:22:00 - INFO - Time taken for Epoch 5:3.99 - F1: 0.4819
2026-02-13 03:22:04 - INFO - Time taken for Epoch 6:3.98 - F1: 0.4844
2026-02-13 03:22:08 - INFO - Time taken for Epoch 7:4.02 - F1: 0.4954
2026-02-13 03:22:12 - INFO - Time taken for Epoch 8:3.99 - F1: 0.4917
2026-02-13 03:22:16 - INFO - Time taken for Epoch 9:3.33 - F1: 0.5062
2026-02-13 03:22:24 - INFO - Time taken for Epoch 10:8.31 - F1: 0.5121
2026-02-13 03:22:28 - INFO - Time taken for Epoch 11:4.00 - F1: 0.5030
2026-02-13 03:22:31 - INFO - Time taken for Epoch 12:3.33 - F1: 0.5019
2026-02-13 03:22:35 - INFO - Time taken for Epoch 13:3.33 - F1: 0.5388
2026-02-13 03:22:39 - INFO - Time taken for Epoch 14:4.03 - F1: 0.5040
2026-02-13 03:22:42 - INFO - Time taken for Epoch 15:3.33 - F1: 0.5010
2026-02-13 03:22:45 - INFO - Time taken for Epoch 16:3.33 - F1: 0.5234
2026-02-13 03:22:49 - INFO - Time taken for Epoch 17:3.33 - F1: 0.5347
2026-02-13 03:22:52 - INFO - Time taken for Epoch 18:3.33 - F1: 0.5273
2026-02-13 03:22:55 - INFO - Time taken for Epoch 19:3.34 - F1: 0.5247
2026-02-13 03:22:59 - INFO - Time taken for Epoch 20:3.33 - F1: 0.5308
2026-02-13 03:23:02 - INFO - Time taken for Epoch 21:3.33 - F1: 0.5473
2026-02-13 03:23:06 - INFO - Time taken for Epoch 22:3.93 - F1: 0.5322
2026-02-13 03:23:09 - INFO - Time taken for Epoch 23:3.34 - F1: 0.5335
2026-02-13 03:23:12 - INFO - Time taken for Epoch 24:3.34 - F1: 0.5279
2026-02-13 03:23:16 - INFO - Time taken for Epoch 25:3.33 - F1: 0.5236
2026-02-13 03:23:19 - INFO - Time taken for Epoch 26:3.35 - F1: 0.5310
2026-02-13 03:23:23 - INFO - Time taken for Epoch 27:3.34 - F1: 0.5466
2026-02-13 03:23:26 - INFO - Time taken for Epoch 28:3.35 - F1: 0.5412
2026-02-13 03:23:29 - INFO - Time taken for Epoch 29:3.34 - F1: 0.5406
2026-02-13 03:23:33 - INFO - Time taken for Epoch 30:3.34 - F1: 0.5387
2026-02-13 03:23:36 - INFO - Time taken for Epoch 31:3.34 - F1: 0.5360
2026-02-13 03:23:36 - INFO - Performance not improving for 10 consecutive epochs.
2026-02-13 03:23:36 - INFO - Best F1:0.5473 - Best Epoch:20
2026-02-13 03:23:42 - INFO - 

Hf Model: GPT-4o PLM: bert-tweet Dataset: humanitarian9, NumShots: 25, N: 25 Test SEED: 1234 F1: 0.5440, Test ECE: 0.1037
2026-02-13 03:23:42 - INFO - All results: {'f1_macro': 0.5440410300207075, 'ece': np.float64(0.10367939718047885)}
2026-02-13 03:23:42 - INFO - 
Total time taken: 548.84 seconds
2026-02-13 03:23:42 - INFO - Trial 0 finished with value: 0.5440410300207075 and parameters: {'learning_rate': 1.1711123256226357e-05, 'weight_decay': 0.0023441093864910475, 'batch_size': 8, 'co_train_epochs': 10, 'epoch_patience': 5}. Best is trial 0 with value: 0.5440410300207075.
2026-02-13 03:23:42 - INFO - Using devices: cuda, cuda
2026-02-13 03:23:42 - INFO - Devices: cuda, cuda
2026-02-13 03:23:42 - INFO - Starting log
2026-02-13 03:23:42 - INFO - Dataset: humanitarian9, Event: hurricane_dorian_2019, N: 25, Seed: 1234, HF Model: GPT-4o, NumShots: 25, PLM: bert-tweet
2026-02-13 03:23:42 - INFO - Learning Rate: 1.3129990051860193e-05
Weight Decay: 0.0006813773184081605
Batch Size: 24
No. Epochs: 7
Epoch Patience: 8
 Accumulation Steps: 2
2026-02-13 03:23:43 - INFO - Generating initial weights
2026-02-13 03:23:59 - INFO - Time taken for Epoch 1:14.30 - F1: 0.0475
2026-02-13 03:24:13 - INFO - Time taken for Epoch 2:14.31 - F1: 0.0519
2026-02-13 03:24:27 - INFO - Time taken for Epoch 3:14.31 - F1: 0.0697
2026-02-13 03:24:42 - INFO - Time taken for Epoch 4:14.31 - F1: 0.0910
2026-02-13 03:24:56 - INFO - Time taken for Epoch 5:14.32 - F1: 0.1113
2026-02-13 03:25:10 - INFO - Time taken for Epoch 6:14.33 - F1: 0.1524
2026-02-13 03:25:24 - INFO - Time taken for Epoch 7:14.28 - F1: 0.1704
2026-02-13 03:25:24 - INFO - Best F1:0.1704 - Best Epoch:7
2026-02-13 03:25:25 - INFO - Starting co-training
2026-02-13 03:25:55 - INFO - Time taken for Epoch 1: 29.44s - F1: 0.40047330
2026-02-13 03:26:25 - INFO - Time taken for Epoch 2: 29.98s - F1: 0.44379782
2026-02-13 03:26:55 - INFO - Time taken for Epoch 3: 30.12s - F1: 0.46572885
2026-02-13 03:27:25 - INFO - Time taken for Epoch 4: 30.08s - F1: 0.45562114
2026-02-13 03:27:54 - INFO - Time taken for Epoch 5: 29.49s - F1: 0.46167095
2026-02-13 03:28:24 - INFO - Time taken for Epoch 6: 29.50s - F1: 0.46437692
2026-02-13 03:28:53 - INFO - Time taken for Epoch 7: 29.47s - F1: 0.46053755
2026-02-13 03:28:55 - INFO - Fine-tuning models
2026-02-13 03:28:58 - INFO - Time taken for Epoch 1:2.71 - F1: 0.4653
2026-02-13 03:29:01 - INFO - Time taken for Epoch 2:3.34 - F1: 0.4471
2026-02-13 03:29:04 - INFO - Time taken for Epoch 3:2.69 - F1: 0.4387
2026-02-13 03:29:07 - INFO - Time taken for Epoch 4:2.68 - F1: 0.4430
2026-02-13 03:29:09 - INFO - Time taken for Epoch 5:2.69 - F1: 0.4514
2026-02-13 03:29:12 - INFO - Time taken for Epoch 6:2.69 - F1: 0.4535
2026-02-13 03:29:15 - INFO - Time taken for Epoch 7:2.69 - F1: 0.4457
2026-02-13 03:29:17 - INFO - Time taken for Epoch 8:2.69 - F1: 0.4442
2026-02-13 03:29:20 - INFO - Time taken for Epoch 9:2.69 - F1: 0.4524
2026-02-13 03:29:23 - INFO - Time taken for Epoch 10:2.69 - F1: 0.4690
2026-02-13 03:29:26 - INFO - Time taken for Epoch 11:3.34 - F1: 0.4654
2026-02-13 03:29:29 - INFO - Time taken for Epoch 12:2.69 - F1: 0.4943
2026-02-13 03:29:32 - INFO - Time taken for Epoch 13:3.36 - F1: 0.5298
2026-02-13 03:29:43 - INFO - Time taken for Epoch 14:11.03 - F1: 0.5056
2026-02-13 03:29:46 - INFO - Time taken for Epoch 15:2.68 - F1: 0.5188
2026-02-13 03:29:48 - INFO - Time taken for Epoch 16:2.68 - F1: 0.5270
2026-02-13 03:29:51 - INFO - Time taken for Epoch 17:2.69 - F1: 0.5260
2026-02-13 03:29:54 - INFO - Time taken for Epoch 18:2.69 - F1: 0.5190
2026-02-13 03:29:57 - INFO - Time taken for Epoch 19:2.69 - F1: 0.5205
2026-02-13 03:29:59 - INFO - Time taken for Epoch 20:2.69 - F1: 0.5267
2026-02-13 03:30:02 - INFO - Time taken for Epoch 21:2.69 - F1: 0.5292
2026-02-13 03:30:05 - INFO - Time taken for Epoch 22:2.69 - F1: 0.5375
2026-02-13 03:30:08 - INFO - Time taken for Epoch 23:3.31 - F1: 0.5324
2026-02-13 03:30:11 - INFO - Time taken for Epoch 24:2.69 - F1: 0.5251
2026-02-13 03:30:13 - INFO - Time taken for Epoch 25:2.69 - F1: 0.5403
2026-02-13 03:30:24 - INFO - Time taken for Epoch 26:10.61 - F1: 0.5383
2026-02-13 03:30:27 - INFO - Time taken for Epoch 27:2.68 - F1: 0.5425
2026-02-13 03:30:30 - INFO - Time taken for Epoch 28:3.31 - F1: 0.5340
2026-02-13 03:30:33 - INFO - Time taken for Epoch 29:2.69 - F1: 0.5381
2026-02-13 03:30:35 - INFO - Time taken for Epoch 30:2.69 - F1: 0.5325
2026-02-13 03:30:38 - INFO - Time taken for Epoch 31:2.69 - F1: 0.5361
2026-02-13 03:30:41 - INFO - Time taken for Epoch 32:2.69 - F1: 0.5439
2026-02-13 03:30:44 - INFO - Time taken for Epoch 33:3.32 - F1: 0.5437
2026-02-13 03:30:47 - INFO - Time taken for Epoch 34:2.69 - F1: 0.5433
2026-02-13 03:30:49 - INFO - Time taken for Epoch 35:2.69 - F1: 0.5445
2026-02-13 03:30:53 - INFO - Time taken for Epoch 36:3.32 - F1: 0.5414
2026-02-13 03:30:55 - INFO - Time taken for Epoch 37:2.69 - F1: 0.5436
2026-02-13 03:30:58 - INFO - Time taken for Epoch 38:2.69 - F1: 0.5472
2026-02-13 03:31:05 - INFO - Time taken for Epoch 39:6.66 - F1: 0.5423
2026-02-13 03:31:07 - INFO - Time taken for Epoch 40:2.68 - F1: 0.5391
2026-02-13 03:31:10 - INFO - Time taken for Epoch 41:2.68 - F1: 0.5506
2026-02-13 03:31:13 - INFO - Time taken for Epoch 42:3.30 - F1: 0.5686
2026-02-13 03:31:17 - INFO - Time taken for Epoch 43:3.43 - F1: 0.5663
2026-02-13 03:31:19 - INFO - Time taken for Epoch 44:2.69 - F1: 0.5674
2026-02-13 03:31:22 - INFO - Time taken for Epoch 45:2.69 - F1: 0.5667
2026-02-13 03:31:25 - INFO - Time taken for Epoch 46:2.69 - F1: 0.5708
2026-02-13 03:31:28 - INFO - Time taken for Epoch 47:3.38 - F1: 0.5888
2026-02-13 03:31:41 - INFO - Time taken for Epoch 48:12.59 - F1: 0.5843
2026-02-13 03:31:44 - INFO - Time taken for Epoch 49:2.69 - F1: 0.5814
2026-02-13 03:31:46 - INFO - Time taken for Epoch 50:2.68 - F1: 0.5765
2026-02-13 03:31:49 - INFO - Time taken for Epoch 51:2.68 - F1: 0.5773
2026-02-13 03:31:52 - INFO - Time taken for Epoch 52:2.69 - F1: 0.5760
2026-02-13 03:31:54 - INFO - Time taken for Epoch 53:2.69 - F1: 0.5773
2026-02-13 03:31:57 - INFO - Time taken for Epoch 54:2.68 - F1: 0.5802
2026-02-13 03:32:00 - INFO - Time taken for Epoch 55:2.69 - F1: 0.5772
2026-02-13 03:32:02 - INFO - Time taken for Epoch 56:2.69 - F1: 0.5770
2026-02-13 03:32:05 - INFO - Time taken for Epoch 57:2.69 - F1: 0.5720
2026-02-13 03:32:05 - INFO - Performance not improving for 10 consecutive epochs.
2026-02-13 03:32:05 - INFO - Best F1:0.5888 - Best Epoch:46
2026-02-13 03:32:10 - INFO - 

Hf Model: GPT-4o PLM: bert-tweet Dataset: humanitarian9, NumShots: 25, N: 25 Test SEED: 1234 F1: 0.5660, Test ECE: 0.0966
2026-02-13 03:32:10 - INFO - All results: {'f1_macro': 0.5660258376516927, 'ece': np.float64(0.09658118252412709)}
2026-02-13 03:32:10 - INFO - 
Total time taken: 508.15 seconds
2026-02-13 03:32:10 - INFO - Trial 1 finished with value: 0.5660258376516927 and parameters: {'learning_rate': 1.3129990051860193e-05, 'weight_decay': 0.0006813773184081605, 'batch_size': 24, 'co_train_epochs': 7, 'epoch_patience': 8}. Best is trial 1 with value: 0.5660258376516927.
2026-02-13 03:32:10 - INFO - Using devices: cuda, cuda
2026-02-13 03:32:10 - INFO - Devices: cuda, cuda
2026-02-13 03:32:10 - INFO - Starting log
2026-02-13 03:32:10 - INFO - Dataset: humanitarian9, Event: hurricane_dorian_2019, N: 25, Seed: 1234, HF Model: GPT-4o, NumShots: 25, PLM: bert-tweet
2026-02-13 03:32:10 - INFO - Learning Rate: 0.0005015593337459653
Weight Decay: 0.004369520389746864
Batch Size: 8
No. Epochs: 20
Epoch Patience: 9
 Accumulation Steps: 8
2026-02-13 03:32:11 - INFO - Generating initial weights
2026-02-13 03:32:30 - INFO - Time taken for Epoch 1:17.54 - F1: 0.0378
2026-02-13 03:32:48 - INFO - Time taken for Epoch 2:17.48 - F1: 0.0212
2026-02-13 03:33:05 - INFO - Time taken for Epoch 3:17.50 - F1: 0.0340
2026-02-13 03:33:23 - INFO - Time taken for Epoch 4:17.50 - F1: 0.0354
2026-02-13 03:33:40 - INFO - Time taken for Epoch 5:17.50 - F1: 0.0354
2026-02-13 03:33:58 - INFO - Time taken for Epoch 6:17.51 - F1: 0.0050
2026-02-13 03:34:15 - INFO - Time taken for Epoch 7:17.48 - F1: 0.0050
2026-02-13 03:34:33 - INFO - Time taken for Epoch 8:17.49 - F1: 0.0050
2026-02-13 03:34:50 - INFO - Time taken for Epoch 9:17.48 - F1: 0.0050
2026-02-13 03:35:08 - INFO - Time taken for Epoch 10:17.51 - F1: 0.0050
2026-02-13 03:35:25 - INFO - Time taken for Epoch 11:17.46 - F1: 0.0256
2026-02-13 03:35:43 - INFO - Time taken for Epoch 12:17.47 - F1: 0.0256
2026-02-13 03:36:00 - INFO - Time taken for Epoch 13:17.48 - F1: 0.0256
2026-02-13 03:36:17 - INFO - Time taken for Epoch 14:17.47 - F1: 0.0256
2026-02-13 03:36:35 - INFO - Time taken for Epoch 15:17.47 - F1: 0.0256
2026-02-13 03:36:52 - INFO - Time taken for Epoch 16:17.47 - F1: 0.0256
2026-02-13 03:37:10 - INFO - Time taken for Epoch 17:17.49 - F1: 0.0050
2026-02-13 03:37:27 - INFO - Time taken for Epoch 18:17.46 - F1: 0.0050
2026-02-13 03:37:45 - INFO - Time taken for Epoch 19:17.46 - F1: 0.0256
2026-02-13 03:38:02 - INFO - Time taken for Epoch 20:17.50 - F1: 0.0256
2026-02-13 03:38:02 - INFO - Best F1:0.0378 - Best Epoch:1
2026-02-13 03:38:03 - INFO - Starting co-training
2026-02-13 03:38:28 - INFO - Time taken for Epoch 1: 24.38s - F1: 0.02286448
2026-02-13 03:38:53 - INFO - Time taken for Epoch 2: 25.06s - F1: 0.02286448
2026-02-13 03:39:17 - INFO - Time taken for Epoch 3: 24.39s - F1: 0.02286448
2026-02-13 03:39:42 - INFO - Time taken for Epoch 4: 24.34s - F1: 0.03396410
2026-02-13 03:40:07 - INFO - Time taken for Epoch 5: 25.02s - F1: 0.03396410
2026-02-13 03:40:31 - INFO - Time taken for Epoch 6: 24.35s - F1: 0.03396410
2026-02-13 03:40:55 - INFO - Time taken for Epoch 7: 24.34s - F1: 0.03396410
2026-02-13 03:41:20 - INFO - Time taken for Epoch 8: 24.36s - F1: 0.03396410
2026-02-13 03:41:44 - INFO - Time taken for Epoch 9: 24.41s - F1: 0.03396410
2026-02-13 03:42:08 - INFO - Time taken for Epoch 10: 24.35s - F1: 0.03396410
2026-02-13 03:42:33 - INFO - Time taken for Epoch 11: 24.37s - F1: 0.03396410
2026-02-13 03:42:57 - INFO - Time taken for Epoch 12: 24.34s - F1: 0.02286448
2026-02-13 03:43:21 - INFO - Time taken for Epoch 13: 24.38s - F1: 0.02286448
2026-02-13 03:43:21 - INFO - Performance not improving for 9 consecutive epochs.
2026-02-13 03:43:23 - INFO - Fine-tuning models
2026-02-13 03:43:26 - INFO - Time taken for Epoch 1:3.36 - F1: 0.0340
2026-02-13 03:43:30 - INFO - Time taken for Epoch 2:4.02 - F1: 0.0340
2026-02-13 03:43:34 - INFO - Time taken for Epoch 3:3.33 - F1: 0.0017
2026-02-13 03:43:37 - INFO - Time taken for Epoch 4:3.34 - F1: 0.0017
2026-02-13 03:43:40 - INFO - Time taken for Epoch 5:3.33 - F1: 0.0340
2026-02-13 03:43:44 - INFO - Time taken for Epoch 6:3.33 - F1: 0.0229
2026-02-13 03:43:47 - INFO - Time taken for Epoch 7:3.33 - F1: 0.0229
2026-02-13 03:43:50 - INFO - Time taken for Epoch 8:3.33 - F1: 0.0050
2026-02-13 03:43:54 - INFO - Time taken for Epoch 9:3.33 - F1: 0.0050
2026-02-13 03:43:57 - INFO - Time taken for Epoch 10:3.34 - F1: 0.0050
2026-02-13 03:44:00 - INFO - Time taken for Epoch 11:3.33 - F1: 0.0050
2026-02-13 03:44:00 - INFO - Performance not improving for 10 consecutive epochs.
2026-02-13 03:44:00 - INFO - Best F1:0.0340 - Best Epoch:0
2026-02-13 03:44:06 - INFO - 

Hf Model: GPT-4o PLM: bert-tweet Dataset: humanitarian9, NumShots: 25, N: 25 Test SEED: 1234 F1: 0.0339, Test ECE: 0.5524
2026-02-13 03:44:06 - INFO - All results: {'f1_macro': 0.03385172693773031, 'ece': np.float64(0.5524192872983391)}
2026-02-13 03:44:06 - INFO - 
Total time taken: 716.29 seconds
2026-02-13 03:44:06 - INFO - Trial 2 finished with value: 0.03385172693773031 and parameters: {'learning_rate': 0.0005015593337459653, 'weight_decay': 0.004369520389746864, 'batch_size': 8, 'co_train_epochs': 20, 'epoch_patience': 9}. Best is trial 1 with value: 0.5660258376516927.
2026-02-13 03:44:06 - INFO - Using devices: cuda, cuda
2026-02-13 03:44:06 - INFO - Devices: cuda, cuda
2026-02-13 03:44:06 - INFO - Starting log
2026-02-13 03:44:06 - INFO - Dataset: humanitarian9, Event: hurricane_dorian_2019, N: 25, Seed: 1234, HF Model: GPT-4o, NumShots: 25, PLM: bert-tweet
2026-02-13 03:44:07 - INFO - Learning Rate: 1.876260103093962e-05
Weight Decay: 0.0024985004491634034
Batch Size: 16
No. Epochs: 20
Epoch Patience: 4
 Accumulation Steps: 4
2026-02-13 03:44:07 - INFO - Generating initial weights
2026-02-13 03:44:24 - INFO - Time taken for Epoch 1:15.40 - F1: 0.0648
2026-02-13 03:44:40 - INFO - Time taken for Epoch 2:15.38 - F1: 0.1073
2026-02-13 03:44:55 - INFO - Time taken for Epoch 3:15.38 - F1: 0.1101
2026-02-13 03:45:10 - INFO - Time taken for Epoch 4:15.38 - F1: 0.1168
2026-02-13 03:45:26 - INFO - Time taken for Epoch 5:15.37 - F1: 0.1274
2026-02-13 03:45:41 - INFO - Time taken for Epoch 6:15.39 - F1: 0.1575
2026-02-13 03:45:57 - INFO - Time taken for Epoch 7:15.37 - F1: 0.2204
2026-02-13 03:46:12 - INFO - Time taken for Epoch 8:15.38 - F1: 0.2937
2026-02-13 03:46:27 - INFO - Time taken for Epoch 9:15.37 - F1: 0.3530
2026-02-13 03:46:43 - INFO - Time taken for Epoch 10:15.38 - F1: 0.4004
2026-02-13 03:46:58 - INFO - Time taken for Epoch 11:15.38 - F1: 0.4328
2026-02-13 03:47:13 - INFO - Time taken for Epoch 12:15.37 - F1: 0.4408
2026-02-13 03:47:29 - INFO - Time taken for Epoch 13:15.38 - F1: 0.4588
2026-02-13 03:47:44 - INFO - Time taken for Epoch 14:15.38 - F1: 0.4642
2026-02-13 03:48:00 - INFO - Time taken for Epoch 15:15.36 - F1: 0.4725
2026-02-13 03:48:15 - INFO - Time taken for Epoch 16:15.38 - F1: 0.4794
2026-02-13 03:48:30 - INFO - Time taken for Epoch 17:15.37 - F1: 0.4910
2026-02-13 03:48:46 - INFO - Time taken for Epoch 18:15.38 - F1: 0.4891
2026-02-13 03:49:01 - INFO - Time taken for Epoch 19:15.39 - F1: 0.4875
2026-02-13 03:49:16 - INFO - Time taken for Epoch 20:15.37 - F1: 0.4825
2026-02-13 03:49:16 - INFO - Best F1:0.4910 - Best Epoch:17
2026-02-13 03:49:17 - INFO - Starting co-training
2026-02-13 03:49:42 - INFO - Time taken for Epoch 1: 24.67s - F1: 0.31154892
2026-02-13 03:50:08 - INFO - Time taken for Epoch 2: 25.40s - F1: 0.42915168
2026-02-13 03:50:33 - INFO - Time taken for Epoch 3: 25.38s - F1: 0.44157351
2026-02-13 03:50:58 - INFO - Time taken for Epoch 4: 25.34s - F1: 0.44829890
2026-02-13 03:51:24 - INFO - Time taken for Epoch 5: 25.37s - F1: 0.45582316
2026-02-13 03:51:49 - INFO - Time taken for Epoch 6: 25.27s - F1: 0.45890588
2026-02-13 03:52:14 - INFO - Time taken for Epoch 7: 25.33s - F1: 0.47054244
2026-02-13 03:52:40 - INFO - Time taken for Epoch 8: 25.28s - F1: 0.48049862
2026-02-13 03:53:05 - INFO - Time taken for Epoch 9: 25.37s - F1: 0.48660289
2026-02-13 03:53:30 - INFO - Time taken for Epoch 10: 25.25s - F1: 0.48014626
2026-02-13 03:53:55 - INFO - Time taken for Epoch 11: 24.72s - F1: 0.48441135
2026-02-13 03:54:20 - INFO - Time taken for Epoch 12: 24.80s - F1: 0.48271275
2026-02-13 03:54:44 - INFO - Time taken for Epoch 13: 24.63s - F1: 0.52616403
2026-02-13 03:55:10 - INFO - Time taken for Epoch 14: 25.49s - F1: 0.54421164
2026-02-13 03:55:35 - INFO - Time taken for Epoch 15: 25.36s - F1: 0.56067401
2026-02-13 03:56:00 - INFO - Time taken for Epoch 16: 25.31s - F1: 0.51202629
2026-02-13 03:56:25 - INFO - Time taken for Epoch 17: 24.68s - F1: 0.55332080
2026-02-13 03:56:50 - INFO - Time taken for Epoch 18: 24.67s - F1: 0.59384674
2026-02-13 03:57:15 - INFO - Time taken for Epoch 19: 25.29s - F1: 0.60129542
2026-02-13 03:57:40 - INFO - Time taken for Epoch 20: 25.34s - F1: 0.62966016
2026-02-13 03:57:43 - INFO - Fine-tuning models
2026-02-13 03:57:46 - INFO - Time taken for Epoch 1:2.87 - F1: 0.5893
2026-02-13 03:57:49 - INFO - Time taken for Epoch 2:3.48 - F1: 0.5888
2026-02-13 03:57:52 - INFO - Time taken for Epoch 3:2.85 - F1: 0.5681
2026-02-13 03:57:55 - INFO - Time taken for Epoch 4:2.85 - F1: 0.5614
2026-02-13 03:57:58 - INFO - Time taken for Epoch 5:2.85 - F1: 0.5614
2026-02-13 03:58:01 - INFO - Time taken for Epoch 6:2.85 - F1: 0.5576
2026-02-13 03:58:04 - INFO - Time taken for Epoch 7:2.86 - F1: 0.5575
2026-02-13 03:58:06 - INFO - Time taken for Epoch 8:2.85 - F1: 0.5566
2026-02-13 03:58:09 - INFO - Time taken for Epoch 9:2.85 - F1: 0.5541
2026-02-13 03:58:12 - INFO - Time taken for Epoch 10:2.85 - F1: 0.5519
2026-02-13 03:58:15 - INFO - Time taken for Epoch 11:2.86 - F1: 0.5533
2026-02-13 03:58:15 - INFO - Performance not improving for 10 consecutive epochs.
2026-02-13 03:58:15 - INFO - Best F1:0.5893 - Best Epoch:0
2026-02-13 03:58:20 - INFO - 

Hf Model: GPT-4o PLM: bert-tweet Dataset: humanitarian9, NumShots: 25, N: 25 Test SEED: 1234 F1: 0.5598, Test ECE: 0.0279
2026-02-13 03:58:20 - INFO - All results: {'f1_macro': 0.559815560890302, 'ece': np.float64(0.027921473592598813)}
2026-02-13 03:58:20 - INFO - 
Total time taken: 853.93 seconds
2026-02-13 03:58:20 - INFO - Trial 3 finished with value: 0.559815560890302 and parameters: {'learning_rate': 1.876260103093962e-05, 'weight_decay': 0.0024985004491634034, 'batch_size': 16, 'co_train_epochs': 20, 'epoch_patience': 4}. Best is trial 1 with value: 0.5660258376516927.
2026-02-13 03:58:20 - INFO - Using devices: cuda, cuda
2026-02-13 03:58:20 - INFO - Devices: cuda, cuda
2026-02-13 03:58:20 - INFO - Starting log
2026-02-13 03:58:20 - INFO - Dataset: humanitarian9, Event: hurricane_dorian_2019, N: 25, Seed: 1234, HF Model: GPT-4o, NumShots: 25, PLM: bert-tweet
2026-02-13 03:58:21 - INFO - Learning Rate: 0.0004418584003014851
Weight Decay: 0.002532035342620066
Batch Size: 8
No. Epochs: 8
Epoch Patience: 8
 Accumulation Steps: 8
2026-02-13 03:58:22 - INFO - Generating initial weights
2026-02-13 03:58:41 - INFO - Time taken for Epoch 1:17.62 - F1: 0.0227
2026-02-13 03:58:58 - INFO - Time taken for Epoch 2:17.55 - F1: 0.0212
2026-02-13 03:59:16 - INFO - Time taken for Epoch 3:17.52 - F1: 0.0340
2026-02-13 03:59:33 - INFO - Time taken for Epoch 4:17.54 - F1: 0.0354
2026-02-13 03:59:51 - INFO - Time taken for Epoch 5:17.53 - F1: 0.0354
2026-02-13 04:00:08 - INFO - Time taken for Epoch 6:17.52 - F1: 0.0050
2026-02-13 04:00:26 - INFO - Time taken for Epoch 7:17.52 - F1: 0.0276
2026-02-13 04:00:43 - INFO - Time taken for Epoch 8:17.56 - F1: 0.0276
2026-02-13 04:00:43 - INFO - Best F1:0.0354 - Best Epoch:4
2026-02-13 04:00:44 - INFO - Starting co-training
2026-02-13 04:01:09 - INFO - Time taken for Epoch 1: 24.38s - F1: 0.02286448
2026-02-13 04:01:34 - INFO - Time taken for Epoch 2: 24.93s - F1: 0.03396410
2026-02-13 04:01:59 - INFO - Time taken for Epoch 3: 25.03s - F1: 0.03396410
2026-02-13 04:02:23 - INFO - Time taken for Epoch 4: 24.33s - F1: 0.03396410
2026-02-13 04:02:47 - INFO - Time taken for Epoch 5: 24.33s - F1: 0.03396410
2026-02-13 04:03:12 - INFO - Time taken for Epoch 6: 24.34s - F1: 0.03396410
2026-02-13 04:03:36 - INFO - Time taken for Epoch 7: 24.34s - F1: 0.03396410
2026-02-13 04:04:00 - INFO - Time taken for Epoch 8: 24.33s - F1: 0.03396410
2026-02-13 04:04:02 - INFO - Fine-tuning models
2026-02-13 04:04:05 - INFO - Time taken for Epoch 1:3.35 - F1: 0.0340
2026-02-13 04:04:10 - INFO - Time taken for Epoch 2:4.22 - F1: 0.0017
2026-02-13 04:04:13 - INFO - Time taken for Epoch 3:3.33 - F1: 0.0017
2026-02-13 04:04:16 - INFO - Time taken for Epoch 4:3.32 - F1: 0.0050
2026-02-13 04:04:20 - INFO - Time taken for Epoch 5:3.33 - F1: 0.0215
2026-02-13 04:04:23 - INFO - Time taken for Epoch 6:3.32 - F1: 0.0215
2026-02-13 04:04:26 - INFO - Time taken for Epoch 7:3.33 - F1: 0.0229
2026-02-13 04:04:30 - INFO - Time taken for Epoch 8:3.33 - F1: 0.0229
2026-02-13 04:04:33 - INFO - Time taken for Epoch 9:3.33 - F1: 0.0050
2026-02-13 04:04:36 - INFO - Time taken for Epoch 10:3.33 - F1: 0.0017
2026-02-13 04:04:40 - INFO - Time taken for Epoch 11:3.33 - F1: 0.0017
2026-02-13 04:04:40 - INFO - Performance not improving for 10 consecutive epochs.
2026-02-13 04:04:40 - INFO - Best F1:0.0340 - Best Epoch:0
2026-02-13 04:04:45 - INFO - 

Hf Model: GPT-4o PLM: bert-tweet Dataset: humanitarian9, NumShots: 25, N: 25 Test SEED: 1234 F1: 0.0339, Test ECE: 0.3311
2026-02-13 04:04:45 - INFO - All results: {'f1_macro': 0.03385172693773031, 'ece': np.float64(0.3310642044803508)}
2026-02-13 04:04:45 - INFO - 
Total time taken: 385.09 seconds
2026-02-13 04:04:45 - INFO - Trial 4 finished with value: 0.03385172693773031 and parameters: {'learning_rate': 0.0004418584003014851, 'weight_decay': 0.002532035342620066, 'batch_size': 8, 'co_train_epochs': 8, 'epoch_patience': 8}. Best is trial 1 with value: 0.5660258376516927.
2026-02-13 04:04:45 - INFO - Using devices: cuda, cuda
2026-02-13 04:04:45 - INFO - Devices: cuda, cuda
2026-02-13 04:04:45 - INFO - Starting log
2026-02-13 04:04:45 - INFO - Dataset: humanitarian9, Event: hurricane_dorian_2019, N: 25, Seed: 1234, HF Model: GPT-4o, NumShots: 25, PLM: bert-tweet
2026-02-13 04:04:46 - INFO - Learning Rate: 3.8145597578456534e-05
Weight Decay: 0.0016059629194431267
Batch Size: 16
No. Epochs: 14
Epoch Patience: 8
 Accumulation Steps: 4
2026-02-13 04:04:47 - INFO - Generating initial weights
2026-02-13 04:05:03 - INFO - Time taken for Epoch 1:15.41 - F1: 0.0831
2026-02-13 04:05:19 - INFO - Time taken for Epoch 2:15.37 - F1: 0.1155
2026-02-13 04:05:34 - INFO - Time taken for Epoch 3:15.38 - F1: 0.1349
2026-02-13 04:05:50 - INFO - Time taken for Epoch 4:15.38 - F1: 0.1685
2026-02-13 04:06:05 - INFO - Time taken for Epoch 5:15.39 - F1: 0.1903
2026-02-13 04:06:20 - INFO - Time taken for Epoch 6:15.38 - F1: 0.3002
2026-02-13 04:06:36 - INFO - Time taken for Epoch 7:15.39 - F1: 0.3943
2026-02-13 04:06:51 - INFO - Time taken for Epoch 8:15.39 - F1: 0.4397
2026-02-13 04:07:07 - INFO - Time taken for Epoch 9:15.38 - F1: 0.4684
2026-02-13 04:07:22 - INFO - Time taken for Epoch 10:15.38 - F1: 0.4864
2026-02-13 04:07:37 - INFO - Time taken for Epoch 11:15.39 - F1: 0.4940
2026-02-13 04:07:53 - INFO - Time taken for Epoch 12:15.39 - F1: 0.4984
2026-02-13 04:08:08 - INFO - Time taken for Epoch 13:15.41 - F1: 0.4861
2026-02-13 04:08:23 - INFO - Time taken for Epoch 14:15.40 - F1: 0.4834
2026-02-13 04:08:23 - INFO - Best F1:0.4984 - Best Epoch:12
2026-02-13 04:08:24 - INFO - Starting co-training
2026-02-13 04:08:49 - INFO - Time taken for Epoch 1: 24.70s - F1: 0.43464275
2026-02-13 04:09:14 - INFO - Time taken for Epoch 2: 25.36s - F1: 0.43115294
2026-02-13 04:09:39 - INFO - Time taken for Epoch 3: 24.64s - F1: 0.44874591
2026-02-13 04:10:05 - INFO - Time taken for Epoch 4: 25.45s - F1: 0.44595076
2026-02-13 04:10:29 - INFO - Time taken for Epoch 5: 24.71s - F1: 0.45458600
2026-02-13 04:10:55 - INFO - Time taken for Epoch 6: 25.36s - F1: 0.48323709
2026-02-13 04:11:20 - INFO - Time taken for Epoch 7: 25.30s - F1: 0.48474333
2026-02-13 04:11:45 - INFO - Time taken for Epoch 8: 25.38s - F1: 0.49659880
2026-02-13 04:12:11 - INFO - Time taken for Epoch 9: 25.38s - F1: 0.47322067
2026-02-13 04:12:35 - INFO - Time taken for Epoch 10: 24.61s - F1: 0.52248967
2026-02-13 04:13:01 - INFO - Time taken for Epoch 11: 25.31s - F1: 0.49696619
2026-02-13 04:13:25 - INFO - Time taken for Epoch 12: 24.78s - F1: 0.56173231
2026-02-13 04:13:51 - INFO - Time taken for Epoch 13: 25.33s - F1: 0.55414342
2026-02-13 04:14:15 - INFO - Time taken for Epoch 14: 24.69s - F1: 0.56429792
2026-02-13 04:14:18 - INFO - Fine-tuning models
2026-02-13 04:14:21 - INFO - Time taken for Epoch 1:2.87 - F1: 0.5745
2026-02-13 04:14:24 - INFO - Time taken for Epoch 2:3.54 - F1: 0.5660
2026-02-13 04:14:27 - INFO - Time taken for Epoch 3:2.85 - F1: 0.5392
2026-02-13 04:14:30 - INFO - Time taken for Epoch 4:2.87 - F1: 0.5362
2026-02-13 04:14:33 - INFO - Time taken for Epoch 5:2.86 - F1: 0.5298
2026-02-13 04:14:36 - INFO - Time taken for Epoch 6:2.86 - F1: 0.5366
2026-02-13 04:14:39 - INFO - Time taken for Epoch 7:2.86 - F1: 0.5454
2026-02-13 04:14:42 - INFO - Time taken for Epoch 8:2.85 - F1: 0.5501
2026-02-13 04:14:44 - INFO - Time taken for Epoch 9:2.86 - F1: 0.5515
2026-02-13 04:14:47 - INFO - Time taken for Epoch 10:2.86 - F1: 0.5556
2026-02-13 04:14:50 - INFO - Time taken for Epoch 11:2.86 - F1: 0.5686
2026-02-13 04:14:50 - INFO - Performance not improving for 10 consecutive epochs.
2026-02-13 04:14:50 - INFO - Best F1:0.5745 - Best Epoch:0
2026-02-13 04:14:55 - INFO - 

Hf Model: GPT-4o PLM: bert-tweet Dataset: humanitarian9, NumShots: 25, N: 25 Test SEED: 1234 F1: 0.5630, Test ECE: 0.0339
2026-02-13 04:14:55 - INFO - All results: {'f1_macro': 0.56295426658924, 'ece': np.float64(0.03388721268594423)}
2026-02-13 04:14:55 - INFO - 
Total time taken: 609.86 seconds
2026-02-13 04:14:55 - INFO - Trial 5 finished with value: 0.56295426658924 and parameters: {'learning_rate': 3.8145597578456534e-05, 'weight_decay': 0.0016059629194431267, 'batch_size': 16, 'co_train_epochs': 14, 'epoch_patience': 8}. Best is trial 1 with value: 0.5660258376516927.
2026-02-13 04:14:55 - INFO - Using devices: cuda, cuda
2026-02-13 04:14:55 - INFO - Devices: cuda, cuda
2026-02-13 04:14:55 - INFO - Starting log
2026-02-13 04:14:55 - INFO - Dataset: humanitarian9, Event: hurricane_dorian_2019, N: 25, Seed: 1234, HF Model: GPT-4o, NumShots: 25, PLM: bert-tweet
2026-02-13 04:14:56 - INFO - Learning Rate: 2.6829984231527862e-05
Weight Decay: 4.8279060547407884e-05
Batch Size: 16
No. Epochs: 6
Epoch Patience: 4
 Accumulation Steps: 4
2026-02-13 04:14:57 - INFO - Generating initial weights
2026-02-13 04:15:13 - INFO - Time taken for Epoch 1:15.42 - F1: 0.0717
2026-02-13 04:15:29 - INFO - Time taken for Epoch 2:15.36 - F1: 0.1074
2026-02-13 04:15:44 - INFO - Time taken for Epoch 3:15.35 - F1: 0.1153
2026-02-13 04:15:59 - INFO - Time taken for Epoch 4:15.37 - F1: 0.1304
2026-02-13 04:16:15 - INFO - Time taken for Epoch 5:15.36 - F1: 0.1633
2026-02-13 04:16:30 - INFO - Time taken for Epoch 6:15.37 - F1: 0.2010
2026-02-13 04:16:30 - INFO - Best F1:0.2010 - Best Epoch:6
2026-02-13 04:16:31 - INFO - Starting co-training
2026-02-13 04:16:56 - INFO - Time taken for Epoch 1: 24.67s - F1: 0.34769833
2026-02-13 04:17:25 - INFO - Time taken for Epoch 2: 29.06s - F1: 0.43170441
2026-02-13 04:17:50 - INFO - Time taken for Epoch 3: 25.33s - F1: 0.45735673
2026-02-13 04:18:15 - INFO - Time taken for Epoch 4: 25.27s - F1: 0.46498509
2026-02-13 04:18:41 - INFO - Time taken for Epoch 5: 25.35s - F1: 0.44131244
2026-02-13 04:19:05 - INFO - Time taken for Epoch 6: 24.66s - F1: 0.46313941
2026-02-13 04:19:07 - INFO - Fine-tuning models
2026-02-13 04:19:10 - INFO - Time taken for Epoch 1:2.87 - F1: 0.4675
2026-02-13 04:19:14 - INFO - Time taken for Epoch 2:4.04 - F1: 0.4694
2026-02-13 04:19:18 - INFO - Time taken for Epoch 3:3.99 - F1: 0.4711
2026-02-13 04:19:22 - INFO - Time taken for Epoch 4:3.68 - F1: 0.4714
2026-02-13 04:19:27 - INFO - Time taken for Epoch 5:4.84 - F1: 0.4910
2026-02-13 04:19:32 - INFO - Time taken for Epoch 6:5.06 - F1: 0.5067
2026-02-13 04:19:38 - INFO - Time taken for Epoch 7:5.68 - F1: 0.5318
2026-02-13 04:19:43 - INFO - Time taken for Epoch 8:5.36 - F1: 0.5423
2026-02-13 04:19:55 - INFO - Time taken for Epoch 9:11.80 - F1: 0.5415
2026-02-13 04:19:58 - INFO - Time taken for Epoch 10:2.84 - F1: 0.5351
2026-02-13 04:20:01 - INFO - Time taken for Epoch 11:2.85 - F1: 0.5456
2026-02-13 04:20:04 - INFO - Time taken for Epoch 12:3.82 - F1: 0.5553
2026-02-13 04:20:09 - INFO - Time taken for Epoch 13:4.30 - F1: 0.5644
2026-02-13 04:20:12 - INFO - Time taken for Epoch 14:3.57 - F1: 0.5663
2026-02-13 04:20:16 - INFO - Time taken for Epoch 15:3.60 - F1: 0.5683
2026-02-13 04:20:20 - INFO - Time taken for Epoch 16:3.96 - F1: 0.5741
2026-02-13 04:20:30 - INFO - Time taken for Epoch 17:10.11 - F1: 0.5744
2026-02-13 04:20:34 - INFO - Time taken for Epoch 18:3.81 - F1: 0.5754
2026-02-13 04:20:37 - INFO - Time taken for Epoch 19:3.51 - F1: 0.5839
2026-02-13 04:20:42 - INFO - Time taken for Epoch 20:4.27 - F1: 0.5835
2026-02-13 04:20:44 - INFO - Time taken for Epoch 21:2.85 - F1: 0.5834
2026-02-13 04:20:47 - INFO - Time taken for Epoch 22:2.86 - F1: 0.5859
2026-02-13 04:20:51 - INFO - Time taken for Epoch 23:4.11 - F1: 0.5874
2026-02-13 04:20:56 - INFO - Time taken for Epoch 24:4.79 - F1: 0.5808
2026-02-13 04:20:59 - INFO - Time taken for Epoch 25:2.86 - F1: 0.5814
2026-02-13 04:21:02 - INFO - Time taken for Epoch 26:2.86 - F1: 0.5844
2026-02-13 04:21:05 - INFO - Time taken for Epoch 27:2.85 - F1: 0.5886
2026-02-13 04:21:08 - INFO - Time taken for Epoch 28:3.55 - F1: 0.5913
2026-02-13 04:21:12 - INFO - Time taken for Epoch 29:3.50 - F1: 0.5806
2026-02-13 04:21:15 - INFO - Time taken for Epoch 30:2.86 - F1: 0.5788
2026-02-13 04:21:17 - INFO - Time taken for Epoch 31:2.86 - F1: 0.5723
2026-02-13 04:21:20 - INFO - Time taken for Epoch 32:2.85 - F1: 0.5708
2026-02-13 04:21:23 - INFO - Time taken for Epoch 33:2.85 - F1: 0.5699
2026-02-13 04:21:26 - INFO - Time taken for Epoch 34:2.86 - F1: 0.5725
2026-02-13 04:21:29 - INFO - Time taken for Epoch 35:2.85 - F1: 0.5782
2026-02-13 04:21:32 - INFO - Time taken for Epoch 36:2.85 - F1: 0.5820
2026-02-13 04:21:35 - INFO - Time taken for Epoch 37:2.86 - F1: 0.5828
2026-02-13 04:21:37 - INFO - Time taken for Epoch 38:2.86 - F1: 0.5828
2026-02-13 04:21:37 - INFO - Performance not improving for 10 consecutive epochs.
2026-02-13 04:21:37 - INFO - Best F1:0.5913 - Best Epoch:27
2026-02-13 04:21:43 - INFO - 

Hf Model: GPT-4o PLM: bert-tweet Dataset: humanitarian9, NumShots: 25, N: 25 Test SEED: 1234 F1: 0.5839, Test ECE: 0.0788
2026-02-13 04:21:43 - INFO - All results: {'f1_macro': 0.5838748291007589, 'ece': np.float64(0.07884738042911103)}
2026-02-13 04:21:43 - INFO - 
Total time taken: 407.37 seconds
2026-02-13 04:21:43 - INFO - Trial 6 finished with value: 0.5838748291007589 and parameters: {'learning_rate': 2.6829984231527862e-05, 'weight_decay': 4.8279060547407884e-05, 'batch_size': 16, 'co_train_epochs': 6, 'epoch_patience': 4}. Best is trial 6 with value: 0.5838748291007589.
2026-02-13 04:21:43 - INFO - Using devices: cuda, cuda
2026-02-13 04:21:43 - INFO - Devices: cuda, cuda
2026-02-13 04:21:43 - INFO - Starting log
2026-02-13 04:21:43 - INFO - Dataset: humanitarian9, Event: hurricane_dorian_2019, N: 25, Seed: 1234, HF Model: GPT-4o, NumShots: 25, PLM: bert-tweet
2026-02-13 04:21:43 - INFO - Learning Rate: 6.49342914378491e-05
Weight Decay: 0.00014417953019497302
Batch Size: 16
No. Epochs: 19
Epoch Patience: 4
 Accumulation Steps: 4
2026-02-13 04:21:44 - INFO - Generating initial weights
2026-02-13 04:22:00 - INFO - Time taken for Epoch 1:15.41 - F1: 0.1128
2026-02-13 04:22:16 - INFO - Time taken for Epoch 2:15.39 - F1: 0.1380
2026-02-13 04:22:31 - INFO - Time taken for Epoch 3:15.38 - F1: 0.1827
2026-02-13 04:22:47 - INFO - Time taken for Epoch 4:15.38 - F1: 0.2128
2026-02-13 04:23:02 - INFO - Time taken for Epoch 5:15.38 - F1: 0.3734
2026-02-13 04:23:17 - INFO - Time taken for Epoch 6:15.37 - F1: 0.4455
2026-02-13 04:23:33 - INFO - Time taken for Epoch 7:15.37 - F1: 0.4704
2026-02-13 04:23:48 - INFO - Time taken for Epoch 8:15.39 - F1: 0.4737
2026-02-13 04:24:03 - INFO - Time taken for Epoch 9:15.38 - F1: 0.4782
2026-02-13 04:24:19 - INFO - Time taken for Epoch 10:15.40 - F1: 0.5018
2026-02-13 04:24:34 - INFO - Time taken for Epoch 11:15.39 - F1: 0.5176
2026-02-13 04:24:50 - INFO - Time taken for Epoch 12:15.36 - F1: 0.4950
2026-02-13 04:25:05 - INFO - Time taken for Epoch 13:15.39 - F1: 0.4995
2026-02-13 04:25:20 - INFO - Time taken for Epoch 14:15.37 - F1: 0.4936
2026-02-13 04:25:36 - INFO - Time taken for Epoch 15:15.37 - F1: 0.5104
2026-02-13 04:25:51 - INFO - Time taken for Epoch 16:15.37 - F1: 0.5122
2026-02-13 04:26:07 - INFO - Time taken for Epoch 17:15.39 - F1: 0.5272
2026-02-13 04:26:22 - INFO - Time taken for Epoch 18:15.39 - F1: 0.5217
2026-02-13 04:26:37 - INFO - Time taken for Epoch 19:15.38 - F1: 0.5291
2026-02-13 04:26:37 - INFO - Best F1:0.5291 - Best Epoch:19
2026-02-13 04:26:38 - INFO - Starting co-training
2026-02-13 04:27:03 - INFO - Time taken for Epoch 1: 24.65s - F1: 0.44205673
2026-02-13 04:27:28 - INFO - Time taken for Epoch 2: 25.64s - F1: 0.43018022
2026-02-13 04:27:53 - INFO - Time taken for Epoch 3: 24.70s - F1: 0.45773147
2026-02-13 04:28:18 - INFO - Time taken for Epoch 4: 25.29s - F1: 0.46464554
2026-02-13 04:28:44 - INFO - Time taken for Epoch 5: 25.35s - F1: 0.45756718
2026-02-13 04:29:08 - INFO - Time taken for Epoch 6: 24.65s - F1: 0.45122878
2026-02-13 04:29:33 - INFO - Time taken for Epoch 7: 24.65s - F1: 0.46096023
2026-02-13 04:29:58 - INFO - Time taken for Epoch 8: 24.65s - F1: 0.50472995
2026-02-13 04:30:23 - INFO - Time taken for Epoch 9: 25.27s - F1: 0.54379734
2026-02-13 04:30:48 - INFO - Time taken for Epoch 10: 25.47s - F1: 0.55884572
2026-02-13 04:31:14 - INFO - Time taken for Epoch 11: 25.29s - F1: 0.55678625
2026-02-13 04:31:39 - INFO - Time taken for Epoch 12: 24.83s - F1: 0.54297870
2026-02-13 04:32:03 - INFO - Time taken for Epoch 13: 24.70s - F1: 0.56494196
2026-02-13 04:32:29 - INFO - Time taken for Epoch 14: 25.41s - F1: 0.54926879
2026-02-13 04:32:53 - INFO - Time taken for Epoch 15: 24.72s - F1: 0.55658419
2026-02-13 04:33:18 - INFO - Time taken for Epoch 16: 24.65s - F1: 0.52477225
2026-02-13 04:33:43 - INFO - Time taken for Epoch 17: 24.67s - F1: 0.54175143
2026-02-13 04:33:43 - INFO - Performance not improving for 4 consecutive epochs.
2026-02-13 04:33:44 - INFO - Fine-tuning models
2026-02-13 04:33:47 - INFO - Time taken for Epoch 1:2.87 - F1: 0.5666
2026-02-13 04:33:51 - INFO - Time taken for Epoch 2:3.47 - F1: 0.5319
2026-02-13 04:33:53 - INFO - Time taken for Epoch 3:2.85 - F1: 0.5267
2026-02-13 04:33:56 - INFO - Time taken for Epoch 4:2.85 - F1: 0.5543
2026-02-13 04:33:59 - INFO - Time taken for Epoch 5:2.85 - F1: 0.5783
2026-02-13 04:34:03 - INFO - Time taken for Epoch 6:3.60 - F1: 0.5820
2026-02-13 04:34:07 - INFO - Time taken for Epoch 7:3.80 - F1: 0.5902
2026-02-13 04:34:10 - INFO - Time taken for Epoch 8:3.66 - F1: 0.5750
2026-02-13 04:34:13 - INFO - Time taken for Epoch 9:2.86 - F1: 0.5718
2026-02-13 04:34:16 - INFO - Time taken for Epoch 10:2.85 - F1: 0.5812
2026-02-13 04:34:19 - INFO - Time taken for Epoch 11:2.85 - F1: 0.5882
2026-02-13 04:34:22 - INFO - Time taken for Epoch 12:2.85 - F1: 0.5870
2026-02-13 04:34:25 - INFO - Time taken for Epoch 13:2.86 - F1: 0.5855
2026-02-13 04:34:27 - INFO - Time taken for Epoch 14:2.86 - F1: 0.5725
2026-02-13 04:34:30 - INFO - Time taken for Epoch 15:2.85 - F1: 0.5700
2026-02-13 04:34:33 - INFO - Time taken for Epoch 16:2.86 - F1: 0.5687
2026-02-13 04:34:36 - INFO - Time taken for Epoch 17:2.86 - F1: 0.5750
2026-02-13 04:34:36 - INFO - Performance not improving for 10 consecutive epochs.
2026-02-13 04:34:36 - INFO - Best F1:0.5902 - Best Epoch:6
2026-02-13 04:34:41 - INFO - 

Hf Model: GPT-4o PLM: bert-tweet Dataset: humanitarian9, NumShots: 25, N: 25 Test SEED: 1234 F1: 0.5786, Test ECE: 0.0688
2026-02-13 04:34:41 - INFO - All results: {'f1_macro': 0.5785848032062513, 'ece': np.float64(0.06878035201318067)}
2026-02-13 04:34:41 - INFO - 
Total time taken: 778.38 seconds
2026-02-13 04:34:41 - INFO - Trial 7 finished with value: 0.5785848032062513 and parameters: {'learning_rate': 6.49342914378491e-05, 'weight_decay': 0.00014417953019497302, 'batch_size': 16, 'co_train_epochs': 19, 'epoch_patience': 4}. Best is trial 6 with value: 0.5838748291007589.
2026-02-13 04:34:41 - INFO - Using devices: cuda, cuda
2026-02-13 04:34:41 - INFO - Devices: cuda, cuda
2026-02-13 04:34:41 - INFO - Starting log
2026-02-13 04:34:41 - INFO - Dataset: humanitarian9, Event: hurricane_dorian_2019, N: 25, Seed: 1234, HF Model: GPT-4o, NumShots: 25, PLM: bert-tweet
2026-02-13 04:34:42 - INFO - Learning Rate: 2.441717926212389e-05
Weight Decay: 1.2039939255060805e-05
Batch Size: 8
No. Epochs: 12
Epoch Patience: 7
 Accumulation Steps: 8
2026-02-13 04:34:42 - INFO - Generating initial weights
2026-02-13 04:35:01 - INFO - Time taken for Epoch 1:17.63 - F1: 0.0558
2026-02-13 04:35:19 - INFO - Time taken for Epoch 2:17.57 - F1: 0.0944
2026-02-13 04:35:37 - INFO - Time taken for Epoch 3:17.60 - F1: 0.1187
2026-02-13 04:35:54 - INFO - Time taken for Epoch 4:17.62 - F1: 0.1494
2026-02-13 04:36:12 - INFO - Time taken for Epoch 5:17.61 - F1: 0.1608
2026-02-13 04:36:29 - INFO - Time taken for Epoch 6:17.62 - F1: 0.1856
2026-02-13 04:36:47 - INFO - Time taken for Epoch 7:17.58 - F1: 0.2263
2026-02-13 04:37:05 - INFO - Time taken for Epoch 8:17.58 - F1: 0.2776
2026-02-13 04:37:22 - INFO - Time taken for Epoch 9:17.59 - F1: 0.3317
2026-02-13 04:37:40 - INFO - Time taken for Epoch 10:17.61 - F1: 0.3740
2026-02-13 04:37:57 - INFO - Time taken for Epoch 11:17.59 - F1: 0.3745
2026-02-13 04:38:15 - INFO - Time taken for Epoch 12:17.58 - F1: 0.4017
2026-02-13 04:38:15 - INFO - Best F1:0.4017 - Best Epoch:12
2026-02-13 04:38:16 - INFO - Starting co-training
2026-02-13 04:38:40 - INFO - Time taken for Epoch 1: 24.38s - F1: 0.29035483
2026-02-13 04:39:05 - INFO - Time taken for Epoch 2: 24.99s - F1: 0.42799553
2026-02-13 04:39:30 - INFO - Time taken for Epoch 3: 25.03s - F1: 0.45475179
2026-02-13 04:39:56 - INFO - Time taken for Epoch 4: 25.25s - F1: 0.44622255
2026-02-13 04:40:20 - INFO - Time taken for Epoch 5: 24.37s - F1: 0.44758530
2026-02-13 04:40:44 - INFO - Time taken for Epoch 6: 24.36s - F1: 0.45650081
2026-02-13 04:41:09 - INFO - Time taken for Epoch 7: 24.98s - F1: 0.45035203
2026-02-13 04:41:34 - INFO - Time taken for Epoch 8: 24.37s - F1: 0.47364915
2026-02-13 04:41:59 - INFO - Time taken for Epoch 9: 25.39s - F1: 0.49826396
2026-02-13 04:42:24 - INFO - Time taken for Epoch 10: 25.04s - F1: 0.48801313
2026-02-13 04:42:48 - INFO - Time taken for Epoch 11: 24.40s - F1: 0.49926408
2026-02-13 04:43:14 - INFO - Time taken for Epoch 12: 25.10s - F1: 0.50409056
2026-02-13 04:43:16 - INFO - Fine-tuning models
2026-02-13 04:43:19 - INFO - Time taken for Epoch 1:3.36 - F1: 0.5364
2026-02-13 04:43:23 - INFO - Time taken for Epoch 2:3.85 - F1: 0.5322
2026-02-13 04:43:26 - INFO - Time taken for Epoch 3:3.34 - F1: 0.5170
2026-02-13 04:43:30 - INFO - Time taken for Epoch 4:3.34 - F1: 0.5067
2026-02-13 04:43:33 - INFO - Time taken for Epoch 5:3.34 - F1: 0.4992
2026-02-13 04:43:36 - INFO - Time taken for Epoch 6:3.34 - F1: 0.5046
2026-02-13 04:43:40 - INFO - Time taken for Epoch 7:3.34 - F1: 0.5076
2026-02-13 04:43:43 - INFO - Time taken for Epoch 8:3.34 - F1: 0.5154
2026-02-13 04:43:46 - INFO - Time taken for Epoch 9:3.34 - F1: 0.5181
2026-02-13 04:43:50 - INFO - Time taken for Epoch 10:3.34 - F1: 0.5495
2026-02-13 04:43:59 - INFO - Time taken for Epoch 11:9.67 - F1: 0.5923
2026-02-13 04:44:03 - INFO - Time taken for Epoch 12:3.90 - F1: 0.5909
2026-02-13 04:44:07 - INFO - Time taken for Epoch 13:3.34 - F1: 0.6041
2026-02-13 04:44:11 - INFO - Time taken for Epoch 14:3.91 - F1: 0.6047
2026-02-13 04:44:14 - INFO - Time taken for Epoch 15:3.91 - F1: 0.6076
2026-02-13 04:44:18 - INFO - Time taken for Epoch 16:3.96 - F1: 0.6043
2026-02-13 04:44:22 - INFO - Time taken for Epoch 17:3.34 - F1: 0.6110
2026-02-13 04:44:29 - INFO - Time taken for Epoch 18:7.40 - F1: 0.6124
2026-02-13 04:44:33 - INFO - Time taken for Epoch 19:4.04 - F1: 0.6139
2026-02-13 04:44:39 - INFO - Time taken for Epoch 20:5.85 - F1: 0.6112
2026-02-13 04:44:42 - INFO - Time taken for Epoch 21:3.34 - F1: 0.6165
2026-02-13 04:44:47 - INFO - Time taken for Epoch 22:4.18 - F1: 0.6224
2026-02-13 04:44:51 - INFO - Time taken for Epoch 23:3.99 - F1: 0.6266
2026-02-13 04:44:55 - INFO - Time taken for Epoch 24:3.96 - F1: 0.6176
2026-02-13 04:44:58 - INFO - Time taken for Epoch 25:3.34 - F1: 0.6186
2026-02-13 04:45:01 - INFO - Time taken for Epoch 26:3.34 - F1: 0.6172
2026-02-13 04:45:05 - INFO - Time taken for Epoch 27:3.34 - F1: 0.6166
2026-02-13 04:45:08 - INFO - Time taken for Epoch 28:3.34 - F1: 0.6178
2026-02-13 04:45:11 - INFO - Time taken for Epoch 29:3.35 - F1: 0.6280
2026-02-13 04:45:15 - INFO - Time taken for Epoch 30:3.96 - F1: 0.6322
2026-02-13 04:45:19 - INFO - Time taken for Epoch 31:3.91 - F1: 0.6301
2026-02-13 04:45:22 - INFO - Time taken for Epoch 32:3.34 - F1: 0.6282
2026-02-13 04:45:26 - INFO - Time taken for Epoch 33:3.33 - F1: 0.6235
2026-02-13 04:45:29 - INFO - Time taken for Epoch 34:3.34 - F1: 0.6218
2026-02-13 04:45:32 - INFO - Time taken for Epoch 35:3.34 - F1: 0.6218
2026-02-13 04:45:36 - INFO - Time taken for Epoch 36:3.34 - F1: 0.6226
2026-02-13 04:45:39 - INFO - Time taken for Epoch 37:3.34 - F1: 0.6234
2026-02-13 04:45:42 - INFO - Time taken for Epoch 38:3.33 - F1: 0.6221
2026-02-13 04:45:46 - INFO - Time taken for Epoch 39:3.34 - F1: 0.6228
2026-02-13 04:45:49 - INFO - Time taken for Epoch 40:3.35 - F1: 0.6224
2026-02-13 04:45:49 - INFO - Performance not improving for 10 consecutive epochs.
2026-02-13 04:45:49 - INFO - Best F1:0.6322 - Best Epoch:29
2026-02-13 04:45:55 - INFO - 

Hf Model: GPT-4o PLM: bert-tweet Dataset: humanitarian9, NumShots: 25, N: 25 Test SEED: 1234 F1: 0.5891, Test ECE: 0.0693
2026-02-13 04:45:55 - INFO - All results: {'f1_macro': 0.589131722680547, 'ece': np.float64(0.0692750908019372)}
2026-02-13 04:45:55 - INFO - 
Total time taken: 673.79 seconds
2026-02-13 04:45:55 - INFO - Trial 8 finished with value: 0.589131722680547 and parameters: {'learning_rate': 2.441717926212389e-05, 'weight_decay': 1.2039939255060805e-05, 'batch_size': 8, 'co_train_epochs': 12, 'epoch_patience': 7}. Best is trial 8 with value: 0.589131722680547.
2026-02-13 04:45:55 - INFO - Using devices: cuda, cuda
2026-02-13 04:45:55 - INFO - Devices: cuda, cuda
2026-02-13 04:45:55 - INFO - Starting log
2026-02-13 04:45:55 - INFO - Dataset: humanitarian9, Event: hurricane_dorian_2019, N: 25, Seed: 1234, HF Model: GPT-4o, NumShots: 25, PLM: bert-tweet
2026-02-13 04:45:55 - INFO - Learning Rate: 0.0008839901361415959
Weight Decay: 0.0014795465368693677
Batch Size: 16
No. Epochs: 9
Epoch Patience: 4
 Accumulation Steps: 4
2026-02-13 04:45:56 - INFO - Generating initial weights
2026-02-13 04:46:13 - INFO - Time taken for Epoch 1:15.39 - F1: 0.0258
2026-02-13 04:46:28 - INFO - Time taken for Epoch 2:15.33 - F1: 0.0212
2026-02-13 04:46:43 - INFO - Time taken for Epoch 3:15.34 - F1: 0.0017
2026-02-13 04:46:59 - INFO - Time taken for Epoch 4:15.31 - F1: 0.0041
2026-02-13 04:47:14 - INFO - Time taken for Epoch 5:15.31 - F1: 0.0212
2026-02-13 04:47:29 - INFO - Time taken for Epoch 6:15.29 - F1: 0.0340
2026-02-13 04:47:45 - INFO - Time taken for Epoch 7:15.29 - F1: 0.0017
2026-02-13 04:48:00 - INFO - Time taken for Epoch 8:15.27 - F1: 0.0017
2026-02-13 04:48:15 - INFO - Time taken for Epoch 9:15.28 - F1: 0.0340
2026-02-13 04:48:15 - INFO - Best F1:0.0340 - Best Epoch:6
2026-02-13 04:48:16 - INFO - Starting co-training
2026-02-13 04:48:41 - INFO - Time taken for Epoch 1: 24.61s - F1: 0.02286448
2026-02-13 04:49:06 - INFO - Time taken for Epoch 2: 25.18s - F1: 0.02286448
2026-02-13 04:49:30 - INFO - Time taken for Epoch 3: 24.67s - F1: 0.02286448
2026-02-13 04:49:55 - INFO - Time taken for Epoch 4: 24.62s - F1: 0.03396410
2026-02-13 04:50:20 - INFO - Time taken for Epoch 5: 25.35s - F1: 0.03396410
2026-02-13 04:50:45 - INFO - Time taken for Epoch 6: 24.67s - F1: 0.03396410
2026-02-13 04:51:10 - INFO - Time taken for Epoch 7: 24.62s - F1: 0.03396410
2026-02-13 04:51:34 - INFO - Time taken for Epoch 8: 24.67s - F1: 0.03396410
2026-02-13 04:51:34 - INFO - Performance not improving for 4 consecutive epochs.
2026-02-13 04:51:36 - INFO - Fine-tuning models
2026-02-13 04:51:39 - INFO - Time taken for Epoch 1:2.86 - F1: 0.0229
2026-02-13 04:51:42 - INFO - Time taken for Epoch 2:3.36 - F1: 0.0017
2026-02-13 04:51:45 - INFO - Time taken for Epoch 3:2.84 - F1: 0.0017
2026-02-13 04:51:48 - INFO - Time taken for Epoch 4:2.85 - F1: 0.0017
2026-02-13 04:51:51 - INFO - Time taken for Epoch 5:2.84 - F1: 0.0212
2026-02-13 04:51:53 - INFO - Time taken for Epoch 6:2.84 - F1: 0.0212
2026-02-13 04:51:56 - INFO - Time taken for Epoch 7:2.85 - F1: 0.0212
2026-02-13 04:51:59 - INFO - Time taken for Epoch 8:2.84 - F1: 0.0017
2026-02-13 04:52:02 - INFO - Time taken for Epoch 9:2.85 - F1: 0.0017
2026-02-13 04:52:05 - INFO - Time taken for Epoch 10:2.84 - F1: 0.0050
2026-02-13 04:52:08 - INFO - Time taken for Epoch 11:2.84 - F1: 0.0215
2026-02-13 04:52:08 - INFO - Performance not improving for 10 consecutive epochs.
2026-02-13 04:52:08 - INFO - Best F1:0.0229 - Best Epoch:0
2026-02-13 04:52:13 - INFO - 

Hf Model: GPT-4o PLM: bert-tweet Dataset: humanitarian9, NumShots: 25, N: 25 Test SEED: 1234 F1: 0.0229, Test ECE: 0.5537
2026-02-13 04:52:13 - INFO - All results: {'f1_macro': 0.02286998479740895, 'ece': np.float64(0.5536818193266816)}
2026-02-13 04:52:13 - INFO - 
Total time taken: 377.86 seconds
2026-02-13 04:52:13 - INFO - Trial 9 finished with value: 0.02286998479740895 and parameters: {'learning_rate': 0.0008839901361415959, 'weight_decay': 0.0014795465368693677, 'batch_size': 16, 'co_train_epochs': 9, 'epoch_patience': 4}. Best is trial 8 with value: 0.589131722680547.
2026-02-13 04:52:13 - INFO - 
[BEST TRIAL RESULTS]
2026-02-13 04:52:13 - INFO - F1 Score: 0.5891
2026-02-13 04:52:13 - INFO - Params: {'learning_rate': 2.441717926212389e-05, 'weight_decay': 1.2039939255060805e-05, 'batch_size': 8, 'co_train_epochs': 12, 'epoch_patience': 7}
2026-02-13 04:52:13 - INFO -   learning_rate: 2.441717926212389e-05
2026-02-13 04:52:13 - INFO -   weight_decay: 1.2039939255060805e-05
2026-02-13 04:52:13 - INFO -   batch_size: 8
2026-02-13 04:52:13 - INFO -   co_train_epochs: 12
2026-02-13 04:52:13 - INFO -   epoch_patience: 7
2026-02-13 04:52:13 - INFO - 
Total time taken: 5859.89 seconds
