2026-02-13 19:09:51 - INFO - 
[Optuna] Starting hyperparameter search with 10 trials.
2026-02-13 19:09:51 - INFO - A new study created in memory with name: study_humanitarian10_california_wildfires_2018
2026-02-13 19:09:51 - INFO - Using devices: cuda, cuda
2026-02-13 19:09:51 - INFO - Devices: cuda, cuda
2026-02-13 19:09:51 - INFO - Starting log
2026-02-13 19:09:51 - INFO - Dataset: humanitarian10, Event: california_wildfires_2018, N: 25, Seed: 1234, HF Model: GPT-4o, NumShots: 25, PLM: bert-tweet
2026-02-13 19:09:52 - INFO - Learning Rate: 1.4014250274878445e-05
Weight Decay: 0.002054663399357569
Batch Size: 8
No. Epochs: 13
Epoch Patience: 6
 Accumulation Steps: 8
2026-02-13 19:09:53 - INFO - Generating initial weights
2026-02-13 19:10:12 - INFO - Time taken for Epoch 1:18.06 - F1: 0.0539
2026-02-13 19:10:30 - INFO - Time taken for Epoch 2:17.45 - F1: 0.0589
2026-02-13 19:10:47 - INFO - Time taken for Epoch 3:17.20 - F1: 0.0727
2026-02-13 19:11:04 - INFO - Time taken for Epoch 4:17.09 - F1: 0.0857
2026-02-13 19:11:21 - INFO - Time taken for Epoch 5:17.07 - F1: 0.0929
2026-02-13 19:11:38 - INFO - Time taken for Epoch 6:17.14 - F1: 0.0973
2026-02-13 19:11:55 - INFO - Time taken for Epoch 7:17.14 - F1: 0.1065
2026-02-13 19:12:12 - INFO - Time taken for Epoch 8:17.18 - F1: 0.1188
2026-02-13 19:12:29 - INFO - Time taken for Epoch 9:17.09 - F1: 0.1505
2026-02-13 19:12:47 - INFO - Time taken for Epoch 10:17.06 - F1: 0.1873
2026-02-13 19:13:04 - INFO - Time taken for Epoch 11:17.11 - F1: 0.2321
2026-02-13 19:13:21 - INFO - Time taken for Epoch 12:17.09 - F1: 0.2471
2026-02-13 19:13:38 - INFO - Time taken for Epoch 13:17.08 - F1: 0.2676
2026-02-13 19:13:38 - INFO - Best F1:0.2676 - Best Epoch:13
2026-02-13 19:13:39 - INFO - Starting co-training
2026-02-13 19:14:03 - INFO - Time taken for Epoch 1: 24.21s - F1: 0.20911226
2026-02-13 19:14:27 - INFO - Time taken for Epoch 2: 24.44s - F1: 0.21313390
2026-02-13 19:14:52 - INFO - Time taken for Epoch 3: 24.40s - F1: 0.32735882
2026-02-13 19:15:16 - INFO - Time taken for Epoch 4: 24.17s - F1: 0.39239209
2026-02-13 19:15:40 - INFO - Time taken for Epoch 5: 24.21s - F1: 0.41526630
2026-02-13 19:16:04 - INFO - Time taken for Epoch 6: 24.19s - F1: 0.41001946
2026-02-13 19:16:28 - INFO - Time taken for Epoch 7: 23.58s - F1: 0.40564783
2026-02-13 19:16:52 - INFO - Time taken for Epoch 8: 23.51s - F1: 0.43940916
2026-02-13 19:17:16 - INFO - Time taken for Epoch 9: 24.12s - F1: 0.46172466
2026-02-13 19:17:40 - INFO - Time taken for Epoch 10: 24.27s - F1: 0.48285629
2026-02-13 19:18:04 - INFO - Time taken for Epoch 11: 24.35s - F1: 0.51393755
2026-02-13 19:18:29 - INFO - Time taken for Epoch 12: 24.57s - F1: 0.50912881
2026-02-13 19:18:52 - INFO - Time taken for Epoch 13: 23.48s - F1: 0.53417884
2026-02-13 19:18:54 - INFO - Fine-tuning models
2026-02-13 19:18:58 - INFO - Time taken for Epoch 1:3.38 - F1: 0.5408
2026-02-13 19:19:02 - INFO - Time taken for Epoch 2:3.94 - F1: 0.5440
2026-02-13 19:19:06 - INFO - Time taken for Epoch 3:3.95 - F1: 0.5318
2026-02-13 19:19:09 - INFO - Time taken for Epoch 4:3.38 - F1: 0.5373
2026-02-13 19:19:13 - INFO - Time taken for Epoch 5:3.36 - F1: 0.5391
2026-02-13 19:19:16 - INFO - Time taken for Epoch 6:3.37 - F1: 0.5381
2026-02-13 19:19:19 - INFO - Time taken for Epoch 7:3.36 - F1: 0.5444
2026-02-13 19:19:23 - INFO - Time taken for Epoch 8:3.94 - F1: 0.5455
2026-02-13 19:19:27 - INFO - Time taken for Epoch 9:3.94 - F1: 0.5400
2026-02-13 19:19:31 - INFO - Time taken for Epoch 10:3.36 - F1: 0.5404
2026-02-13 19:19:34 - INFO - Time taken for Epoch 11:3.36 - F1: 0.5421
2026-02-13 19:19:37 - INFO - Time taken for Epoch 12:3.36 - F1: 0.5419
2026-02-13 19:19:44 - INFO - Time taken for Epoch 13:7.11 - F1: 0.5478
2026-02-13 19:19:49 - INFO - Time taken for Epoch 14:4.45 - F1: 0.5482
2026-02-13 19:19:53 - INFO - Time taken for Epoch 15:4.10 - F1: 0.5464
2026-02-13 19:19:56 - INFO - Time taken for Epoch 16:3.43 - F1: 0.5464
2026-02-13 19:20:00 - INFO - Time taken for Epoch 17:3.38 - F1: 0.5439
2026-02-13 19:20:03 - INFO - Time taken for Epoch 18:3.40 - F1: 0.5525
2026-02-13 19:20:07 - INFO - Time taken for Epoch 19:4.03 - F1: 0.5561
2026-02-13 19:20:11 - INFO - Time taken for Epoch 20:3.99 - F1: 0.5606
2026-02-13 19:20:15 - INFO - Time taken for Epoch 21:4.00 - F1: 0.5616
2026-02-13 19:20:19 - INFO - Time taken for Epoch 22:4.01 - F1: 0.5620
2026-02-13 19:20:31 - INFO - Time taken for Epoch 23:11.37 - F1: 0.5656
2026-02-13 19:20:35 - INFO - Time taken for Epoch 24:4.03 - F1: 0.5612
2026-02-13 19:20:38 - INFO - Time taken for Epoch 25:3.36 - F1: 0.5625
2026-02-13 19:20:41 - INFO - Time taken for Epoch 26:3.38 - F1: 0.5710
2026-02-13 19:20:45 - INFO - Time taken for Epoch 27:4.00 - F1: 0.5732
2026-02-13 19:20:49 - INFO - Time taken for Epoch 28:4.06 - F1: 0.5731
2026-02-13 19:20:53 - INFO - Time taken for Epoch 29:3.37 - F1: 0.5750
2026-02-13 19:20:57 - INFO - Time taken for Epoch 30:4.04 - F1: 0.5802
2026-02-13 19:21:01 - INFO - Time taken for Epoch 31:4.00 - F1: 0.5763
2026-02-13 19:21:04 - INFO - Time taken for Epoch 32:3.35 - F1: 0.5819
2026-02-13 19:21:12 - INFO - Time taken for Epoch 33:7.42 - F1: 0.5819
2026-02-13 19:21:15 - INFO - Time taken for Epoch 34:3.35 - F1: 0.5836
2026-02-13 19:21:19 - INFO - Time taken for Epoch 35:4.00 - F1: 0.5775
2026-02-13 19:21:22 - INFO - Time taken for Epoch 36:3.35 - F1: 0.5837
2026-02-13 19:21:26 - INFO - Time taken for Epoch 37:3.98 - F1: 0.5843
2026-02-13 19:21:30 - INFO - Time taken for Epoch 38:3.99 - F1: 0.5861
2026-02-13 19:21:34 - INFO - Time taken for Epoch 39:3.98 - F1: 0.5885
2026-02-13 19:21:38 - INFO - Time taken for Epoch 40:3.97 - F1: 0.5857
2026-02-13 19:21:42 - INFO - Time taken for Epoch 41:3.36 - F1: 0.5874
2026-02-13 19:21:45 - INFO - Time taken for Epoch 42:3.36 - F1: 0.5896
2026-02-13 19:21:52 - INFO - Time taken for Epoch 43:7.57 - F1: 0.5880
2026-02-13 19:21:56 - INFO - Time taken for Epoch 44:3.36 - F1: 0.5910
2026-02-13 19:22:00 - INFO - Time taken for Epoch 45:4.03 - F1: 0.5920
2026-02-13 19:22:04 - INFO - Time taken for Epoch 46:4.19 - F1: 0.5939
2026-02-13 19:22:08 - INFO - Time taken for Epoch 47:4.11 - F1: 0.5945
2026-02-13 19:22:12 - INFO - Time taken for Epoch 48:3.98 - F1: 0.5923
2026-02-13 19:22:16 - INFO - Time taken for Epoch 49:3.36 - F1: 0.5860
2026-02-13 19:22:19 - INFO - Time taken for Epoch 50:3.35 - F1: 0.5837
2026-02-13 19:22:22 - INFO - Time taken for Epoch 51:3.35 - F1: 0.5826
2026-02-13 19:22:26 - INFO - Time taken for Epoch 52:3.36 - F1: 0.5865
2026-02-13 19:22:29 - INFO - Time taken for Epoch 53:3.36 - F1: 0.5889
2026-02-13 19:22:32 - INFO - Time taken for Epoch 54:3.36 - F1: 0.5889
2026-02-13 19:22:36 - INFO - Time taken for Epoch 55:3.36 - F1: 0.5893
2026-02-13 19:22:39 - INFO - Time taken for Epoch 56:3.36 - F1: 0.5899
2026-02-13 19:22:42 - INFO - Time taken for Epoch 57:3.35 - F1: 0.5852
2026-02-13 19:22:42 - INFO - Performance not improving for 10 consecutive epochs.
2026-02-13 19:22:42 - INFO - Best F1:0.5945 - Best Epoch:46
2026-02-13 19:22:48 - INFO - 

Hf Model: GPT-4o PLM: bert-tweet Dataset: humanitarian10, NumShots: 25, N: 25 Test SEED: 1234 F1: 0.6227, Test ECE: 0.0661
2026-02-13 19:22:48 - INFO - All results: {'f1_macro': 0.6226851875778698, 'ece': np.float64(0.06613053339625938)}
2026-02-13 19:22:48 - INFO - 
Total time taken: 776.96 seconds
2026-02-13 19:22:48 - INFO - Trial 0 finished with value: 0.6226851875778698 and parameters: {'learning_rate': 1.4014250274878445e-05, 'weight_decay': 0.002054663399357569, 'batch_size': 8, 'co_train_epochs': 13, 'epoch_patience': 6}. Best is trial 0 with value: 0.6226851875778698.
2026-02-13 19:22:48 - INFO - Using devices: cuda, cuda
2026-02-13 19:22:48 - INFO - Devices: cuda, cuda
2026-02-13 19:22:48 - INFO - Starting log
2026-02-13 19:22:48 - INFO - Dataset: humanitarian10, Event: california_wildfires_2018, N: 25, Seed: 1234, HF Model: GPT-4o, NumShots: 25, PLM: bert-tweet
2026-02-13 19:22:49 - INFO - Learning Rate: 3.9178129855984625e-05
Weight Decay: 0.00026146959331186797
Batch Size: 16
No. Epochs: 12
Epoch Patience: 10
 Accumulation Steps: 4
2026-02-13 19:22:49 - INFO - Generating initial weights
2026-02-13 19:23:05 - INFO - Time taken for Epoch 1:14.99 - F1: 0.0620
2026-02-13 19:23:20 - INFO - Time taken for Epoch 2:14.97 - F1: 0.0816
2026-02-13 19:23:35 - INFO - Time taken for Epoch 3:14.96 - F1: 0.0878
2026-02-13 19:23:50 - INFO - Time taken for Epoch 4:14.98 - F1: 0.1133
2026-02-13 19:24:05 - INFO - Time taken for Epoch 5:14.98 - F1: 0.1763
2026-02-13 19:24:20 - INFO - Time taken for Epoch 6:14.98 - F1: 0.1970
2026-02-13 19:24:35 - INFO - Time taken for Epoch 7:14.96 - F1: 0.2667
2026-02-13 19:24:50 - INFO - Time taken for Epoch 8:14.97 - F1: 0.3395
2026-02-13 19:25:05 - INFO - Time taken for Epoch 9:14.97 - F1: 0.3737
2026-02-13 19:25:20 - INFO - Time taken for Epoch 10:15.14 - F1: 0.3989
2026-02-13 19:25:35 - INFO - Time taken for Epoch 11:14.97 - F1: 0.4227
2026-02-13 19:25:50 - INFO - Time taken for Epoch 12:14.99 - F1: 0.4554
2026-02-13 19:25:50 - INFO - Best F1:0.4554 - Best Epoch:12
2026-02-13 19:25:51 - INFO - Starting co-training
2026-02-13 19:26:15 - INFO - Time taken for Epoch 1: 24.06s - F1: 0.30764088
2026-02-13 19:26:40 - INFO - Time taken for Epoch 2: 24.46s - F1: 0.34797044
2026-02-13 19:27:05 - INFO - Time taken for Epoch 3: 25.30s - F1: 0.46593993
2026-02-13 19:27:31 - INFO - Time taken for Epoch 4: 25.80s - F1: 0.52960431
2026-02-13 19:27:57 - INFO - Time taken for Epoch 5: 25.64s - F1: 0.52967043
2026-02-13 19:28:22 - INFO - Time taken for Epoch 6: 25.44s - F1: 0.56939414
2026-02-13 19:28:48 - INFO - Time taken for Epoch 7: 25.53s - F1: 0.56624347
2026-02-13 19:29:12 - INFO - Time taken for Epoch 8: 24.84s - F1: 0.57417448
2026-02-13 19:29:38 - INFO - Time taken for Epoch 9: 25.62s - F1: 0.55950779
2026-02-13 19:30:03 - INFO - Time taken for Epoch 10: 24.78s - F1: 0.58209221
2026-02-13 19:30:28 - INFO - Time taken for Epoch 11: 25.65s - F1: 0.59316467
2026-02-13 19:30:54 - INFO - Time taken for Epoch 12: 25.68s - F1: 0.56412414
2026-02-13 19:30:56 - INFO - Fine-tuning models
2026-02-13 19:30:59 - INFO - Time taken for Epoch 1:3.07 - F1: 0.5904
2026-02-13 19:31:02 - INFO - Time taken for Epoch 2:3.67 - F1: 0.5712
2026-02-13 19:31:05 - INFO - Time taken for Epoch 3:3.06 - F1: 0.5445
2026-02-13 19:31:09 - INFO - Time taken for Epoch 4:3.07 - F1: 0.5696
2026-02-13 19:31:12 - INFO - Time taken for Epoch 5:3.05 - F1: 0.5787
2026-02-13 19:31:15 - INFO - Time taken for Epoch 6:3.02 - F1: 0.5893
2026-02-13 19:31:18 - INFO - Time taken for Epoch 7:3.03 - F1: 0.5841
2026-02-13 19:31:21 - INFO - Time taken for Epoch 8:3.10 - F1: 0.5919
2026-02-13 19:31:24 - INFO - Time taken for Epoch 9:3.70 - F1: 0.6000
2026-02-13 19:31:28 - INFO - Time taken for Epoch 10:3.67 - F1: 0.5951
2026-02-13 19:31:31 - INFO - Time taken for Epoch 11:3.05 - F1: 0.5997
2026-02-13 19:31:34 - INFO - Time taken for Epoch 12:3.04 - F1: 0.5918
2026-02-13 19:31:37 - INFO - Time taken for Epoch 13:3.06 - F1: 0.5899
2026-02-13 19:31:40 - INFO - Time taken for Epoch 14:3.05 - F1: 0.5905
2026-02-13 19:31:45 - INFO - Time taken for Epoch 15:4.37 - F1: 0.5862
2026-02-13 19:31:48 - INFO - Time taken for Epoch 16:2.92 - F1: 0.5917
2026-02-13 19:31:51 - INFO - Time taken for Epoch 17:2.91 - F1: 0.5922
2026-02-13 19:31:53 - INFO - Time taken for Epoch 18:2.91 - F1: 0.6056
2026-02-13 19:31:57 - INFO - Time taken for Epoch 19:3.52 - F1: 0.6025
2026-02-13 19:32:00 - INFO - Time taken for Epoch 20:2.92 - F1: 0.6061
2026-02-13 19:32:03 - INFO - Time taken for Epoch 21:3.57 - F1: 0.6047
2026-02-13 19:32:06 - INFO - Time taken for Epoch 22:2.91 - F1: 0.6023
2026-02-13 19:32:09 - INFO - Time taken for Epoch 23:2.92 - F1: 0.5977
2026-02-13 19:32:12 - INFO - Time taken for Epoch 24:2.91 - F1: 0.5972
2026-02-13 19:32:15 - INFO - Time taken for Epoch 25:2.91 - F1: 0.6006
2026-02-13 19:32:18 - INFO - Time taken for Epoch 26:2.92 - F1: 0.5976
2026-02-13 19:32:21 - INFO - Time taken for Epoch 27:2.91 - F1: 0.5945
2026-02-13 19:32:24 - INFO - Time taken for Epoch 28:2.92 - F1: 0.5900
2026-02-13 19:32:27 - INFO - Time taken for Epoch 29:2.94 - F1: 0.5915
2026-02-13 19:32:30 - INFO - Time taken for Epoch 30:2.96 - F1: 0.5940
2026-02-13 19:32:30 - INFO - Performance not improving for 10 consecutive epochs.
2026-02-13 19:32:30 - INFO - Best F1:0.6061 - Best Epoch:19
2026-02-13 19:32:35 - INFO - 

Hf Model: GPT-4o PLM: bert-tweet Dataset: humanitarian10, NumShots: 25, N: 25 Test SEED: 1234 F1: 0.6333, Test ECE: 0.0620
2026-02-13 19:32:35 - INFO - All results: {'f1_macro': 0.6332674015130351, 'ece': np.float64(0.06197425194752697)}
2026-02-13 19:32:35 - INFO - 
Total time taken: 586.94 seconds
2026-02-13 19:32:35 - INFO - Trial 1 finished with value: 0.6332674015130351 and parameters: {'learning_rate': 3.9178129855984625e-05, 'weight_decay': 0.00026146959331186797, 'batch_size': 16, 'co_train_epochs': 12, 'epoch_patience': 10}. Best is trial 1 with value: 0.6332674015130351.
2026-02-13 19:32:35 - INFO - Using devices: cuda, cuda
2026-02-13 19:32:35 - INFO - Devices: cuda, cuda
2026-02-13 19:32:35 - INFO - Starting log
2026-02-13 19:32:35 - INFO - Dataset: humanitarian10, Event: california_wildfires_2018, N: 25, Seed: 1234, HF Model: GPT-4o, NumShots: 25, PLM: bert-tweet
2026-02-13 19:32:36 - INFO - Learning Rate: 6.267168508601649e-05
Weight Decay: 5.263990430396701e-05
Batch Size: 8
No. Epochs: 7
Epoch Patience: 5
 Accumulation Steps: 8
2026-02-13 19:32:36 - INFO - Generating initial weights
2026-02-13 19:32:55 - INFO - Time taken for Epoch 1:17.31 - F1: 0.0658
2026-02-13 19:33:12 - INFO - Time taken for Epoch 2:17.30 - F1: 0.1025
2026-02-13 19:33:29 - INFO - Time taken for Epoch 3:17.42 - F1: 0.0926
2026-02-13 19:33:47 - INFO - Time taken for Epoch 4:17.11 - F1: 0.1311
2026-02-13 19:34:04 - INFO - Time taken for Epoch 5:17.08 - F1: 0.2675
2026-02-13 19:34:21 - INFO - Time taken for Epoch 6:17.08 - F1: 0.3162
2026-02-13 19:34:38 - INFO - Time taken for Epoch 7:17.06 - F1: 0.3279
2026-02-13 19:34:38 - INFO - Best F1:0.3279 - Best Epoch:7
2026-02-13 19:34:39 - INFO - Starting co-training
2026-02-13 19:35:02 - INFO - Time taken for Epoch 1: 23.50s - F1: 0.24492372
2026-02-13 19:35:26 - INFO - Time taken for Epoch 2: 24.08s - F1: 0.33172523
2026-02-13 19:35:50 - INFO - Time taken for Epoch 3: 24.12s - F1: 0.41175236
2026-02-13 19:36:14 - INFO - Time taken for Epoch 4: 24.07s - F1: 0.41130166
2026-02-13 19:36:38 - INFO - Time taken for Epoch 5: 23.51s - F1: 0.43346902
2026-02-13 19:37:02 - INFO - Time taken for Epoch 6: 24.50s - F1: 0.48499734
2026-02-13 19:37:28 - INFO - Time taken for Epoch 7: 25.16s - F1: 0.47135376
2026-02-13 19:37:29 - INFO - Fine-tuning models
2026-02-13 19:37:33 - INFO - Time taken for Epoch 1:3.48 - F1: 0.4902
2026-02-13 19:37:37 - INFO - Time taken for Epoch 2:4.05 - F1: 0.5204
2026-02-13 19:37:41 - INFO - Time taken for Epoch 3:4.09 - F1: 0.5322
2026-02-13 19:37:45 - INFO - Time taken for Epoch 4:4.06 - F1: 0.5502
2026-02-13 19:37:49 - INFO - Time taken for Epoch 5:4.07 - F1: 0.5249
2026-02-13 19:37:52 - INFO - Time taken for Epoch 6:3.41 - F1: 0.5357
2026-02-13 19:37:56 - INFO - Time taken for Epoch 7:3.42 - F1: 0.5530
2026-02-13 19:38:00 - INFO - Time taken for Epoch 8:4.02 - F1: 0.5527
2026-02-13 19:38:03 - INFO - Time taken for Epoch 9:3.40 - F1: 0.5668
2026-02-13 19:38:07 - INFO - Time taken for Epoch 10:4.06 - F1: 0.5665
2026-02-13 19:38:11 - INFO - Time taken for Epoch 11:3.42 - F1: 0.5768
2026-02-13 19:38:21 - INFO - Time taken for Epoch 12:10.33 - F1: 0.5885
2026-02-13 19:38:25 - INFO - Time taken for Epoch 13:4.06 - F1: 0.5924
2026-02-13 19:38:29 - INFO - Time taken for Epoch 14:4.05 - F1: 0.5837
2026-02-13 19:38:33 - INFO - Time taken for Epoch 15:3.44 - F1: 0.5875
2026-02-13 19:38:36 - INFO - Time taken for Epoch 16:3.43 - F1: 0.6018
2026-02-13 19:38:40 - INFO - Time taken for Epoch 17:4.05 - F1: 0.6004
2026-02-13 19:38:43 - INFO - Time taken for Epoch 18:3.40 - F1: 0.5961
2026-02-13 19:38:47 - INFO - Time taken for Epoch 19:3.37 - F1: 0.5928
2026-02-13 19:38:50 - INFO - Time taken for Epoch 20:3.36 - F1: 0.5991
2026-02-13 19:38:53 - INFO - Time taken for Epoch 21:3.37 - F1: 0.5885
2026-02-13 19:38:57 - INFO - Time taken for Epoch 22:3.36 - F1: 0.5878
2026-02-13 19:39:00 - INFO - Time taken for Epoch 23:3.36 - F1: 0.5847
2026-02-13 19:39:04 - INFO - Time taken for Epoch 24:3.36 - F1: 0.5913
2026-02-13 19:39:07 - INFO - Time taken for Epoch 25:3.36 - F1: 0.5906
2026-02-13 19:39:10 - INFO - Time taken for Epoch 26:3.37 - F1: 0.5934
2026-02-13 19:39:10 - INFO - Performance not improving for 10 consecutive epochs.
2026-02-13 19:39:10 - INFO - Best F1:0.6018 - Best Epoch:15
2026-02-13 19:39:16 - INFO - 

Hf Model: GPT-4o PLM: bert-tweet Dataset: humanitarian10, NumShots: 25, N: 25 Test SEED: 1234 F1: 0.6052, Test ECE: 0.0779
2026-02-13 19:39:16 - INFO - All results: {'f1_macro': 0.6052008865297143, 'ece': np.float64(0.07787071636570063)}
2026-02-13 19:39:16 - INFO - 
Total time taken: 400.83 seconds
2026-02-13 19:39:16 - INFO - Trial 2 finished with value: 0.6052008865297143 and parameters: {'learning_rate': 6.267168508601649e-05, 'weight_decay': 5.263990430396701e-05, 'batch_size': 8, 'co_train_epochs': 7, 'epoch_patience': 5}. Best is trial 1 with value: 0.6332674015130351.
2026-02-13 19:39:16 - INFO - Using devices: cuda, cuda
2026-02-13 19:39:16 - INFO - Devices: cuda, cuda
2026-02-13 19:39:16 - INFO - Starting log
2026-02-13 19:39:16 - INFO - Dataset: humanitarian10, Event: california_wildfires_2018, N: 25, Seed: 1234, HF Model: GPT-4o, NumShots: 25, PLM: bert-tweet
2026-02-13 19:39:16 - INFO - Learning Rate: 0.00011129491702763256
Weight Decay: 0.006505955700945937
Batch Size: 8
No. Epochs: 20
Epoch Patience: 6
 Accumulation Steps: 8
2026-02-13 19:39:17 - INFO - Generating initial weights
2026-02-13 19:39:36 - INFO - Time taken for Epoch 1:17.21 - F1: 0.0733
2026-02-13 19:39:53 - INFO - Time taken for Epoch 2:17.39 - F1: 0.0508
2026-02-13 19:40:10 - INFO - Time taken for Epoch 3:17.44 - F1: 0.1287
2026-02-13 19:40:28 - INFO - Time taken for Epoch 4:17.85 - F1: 0.2135
2026-02-13 19:40:45 - INFO - Time taken for Epoch 5:17.26 - F1: 0.2768
2026-02-13 19:41:03 - INFO - Time taken for Epoch 6:17.28 - F1: 0.3141
2026-02-13 19:41:20 - INFO - Time taken for Epoch 7:17.66 - F1: 0.3729
2026-02-13 19:41:37 - INFO - Time taken for Epoch 8:17.09 - F1: 0.3965
2026-02-13 19:41:55 - INFO - Time taken for Epoch 9:17.10 - F1: 0.4719
2026-02-13 19:42:12 - INFO - Time taken for Epoch 10:17.10 - F1: 0.4675
2026-02-13 19:42:29 - INFO - Time taken for Epoch 11:17.12 - F1: 0.4829
2026-02-13 19:42:46 - INFO - Time taken for Epoch 12:17.08 - F1: 0.4893
2026-02-13 19:43:03 - INFO - Time taken for Epoch 13:17.10 - F1: 0.4549
2026-02-13 19:43:20 - INFO - Time taken for Epoch 14:17.09 - F1: 0.4783
2026-02-13 19:43:37 - INFO - Time taken for Epoch 15:17.07 - F1: 0.4986
2026-02-13 19:43:54 - INFO - Time taken for Epoch 16:17.09 - F1: 0.4903
2026-02-13 19:44:11 - INFO - Time taken for Epoch 17:17.09 - F1: 0.5006
2026-02-13 19:44:28 - INFO - Time taken for Epoch 18:17.11 - F1: 0.5097
2026-02-13 19:44:46 - INFO - Time taken for Epoch 19:17.10 - F1: 0.4922
2026-02-13 19:45:03 - INFO - Time taken for Epoch 20:17.08 - F1: 0.4924
2026-02-13 19:45:03 - INFO - Best F1:0.5097 - Best Epoch:18
2026-02-13 19:45:03 - INFO - Starting co-training
2026-02-13 19:45:27 - INFO - Time taken for Epoch 1: 23.52s - F1: 0.21251199
2026-02-13 19:45:51 - INFO - Time taken for Epoch 2: 24.10s - F1: 0.26530661
2026-02-13 19:46:15 - INFO - Time taken for Epoch 3: 24.39s - F1: 0.28585087
2026-02-13 19:46:40 - INFO - Time taken for Epoch 4: 24.14s - F1: 0.32526288
2026-02-13 19:47:04 - INFO - Time taken for Epoch 5: 24.12s - F1: 0.27751944
2026-02-13 19:47:27 - INFO - Time taken for Epoch 6: 23.47s - F1: 0.32127827
2026-02-13 19:47:51 - INFO - Time taken for Epoch 7: 23.46s - F1: 0.33136186
2026-02-13 19:48:15 - INFO - Time taken for Epoch 8: 24.10s - F1: 0.33131376
2026-02-13 19:48:38 - INFO - Time taken for Epoch 9: 23.65s - F1: 0.37994841
2026-02-13 19:49:03 - INFO - Time taken for Epoch 10: 24.28s - F1: 0.37188764
2026-02-13 19:49:26 - INFO - Time taken for Epoch 11: 23.58s - F1: 0.36708754
2026-02-13 19:49:50 - INFO - Time taken for Epoch 12: 23.50s - F1: 0.38998072
2026-02-13 19:50:14 - INFO - Time taken for Epoch 13: 24.17s - F1: 0.36738806
2026-02-13 19:50:38 - INFO - Time taken for Epoch 14: 23.55s - F1: 0.28705761
2026-02-13 19:51:01 - INFO - Time taken for Epoch 15: 23.52s - F1: 0.33746111
2026-02-13 19:51:25 - INFO - Time taken for Epoch 16: 23.50s - F1: 0.43041796
2026-02-13 19:51:49 - INFO - Time taken for Epoch 17: 24.14s - F1: 0.36124418
2026-02-13 19:52:12 - INFO - Time taken for Epoch 18: 23.52s - F1: 0.32863867
2026-02-13 19:52:36 - INFO - Time taken for Epoch 19: 23.52s - F1: 0.40313671
2026-02-13 19:52:59 - INFO - Time taken for Epoch 20: 23.52s - F1: 0.41757393
2026-02-13 19:53:01 - INFO - Fine-tuning models
2026-02-13 19:53:04 - INFO - Time taken for Epoch 1:3.41 - F1: 0.4537
2026-02-13 19:53:08 - INFO - Time taken for Epoch 2:3.98 - F1: 0.4289
2026-02-13 19:53:12 - INFO - Time taken for Epoch 3:3.36 - F1: 0.4164
2026-02-13 19:53:15 - INFO - Time taken for Epoch 4:3.36 - F1: 0.4433
2026-02-13 19:53:18 - INFO - Time taken for Epoch 5:3.36 - F1: 0.4636
2026-02-13 19:53:22 - INFO - Time taken for Epoch 6:4.04 - F1: 0.4777
2026-02-13 19:53:26 - INFO - Time taken for Epoch 7:4.02 - F1: 0.4533
2026-02-13 19:53:30 - INFO - Time taken for Epoch 8:3.36 - F1: 0.4766
2026-02-13 19:53:33 - INFO - Time taken for Epoch 9:3.36 - F1: 0.4917
2026-02-13 19:53:37 - INFO - Time taken for Epoch 10:4.27 - F1: 0.4922
2026-02-13 19:53:50 - INFO - Time taken for Epoch 11:12.67 - F1: 0.4935
2026-02-13 19:53:54 - INFO - Time taken for Epoch 12:4.07 - F1: 0.5002
2026-02-13 19:53:58 - INFO - Time taken for Epoch 13:4.01 - F1: 0.5157
2026-02-13 19:54:02 - INFO - Time taken for Epoch 14:4.04 - F1: 0.5278
2026-02-13 19:54:06 - INFO - Time taken for Epoch 15:4.04 - F1: 0.5231
2026-02-13 19:54:10 - INFO - Time taken for Epoch 16:3.36 - F1: 0.4181
2026-02-13 19:54:13 - INFO - Time taken for Epoch 17:3.36 - F1: 0.4119
2026-02-13 19:54:16 - INFO - Time taken for Epoch 18:3.36 - F1: 0.4195
2026-02-13 19:54:20 - INFO - Time taken for Epoch 19:3.37 - F1: 0.4270
2026-02-13 19:54:23 - INFO - Time taken for Epoch 20:3.36 - F1: 0.4265
2026-02-13 19:54:27 - INFO - Time taken for Epoch 21:4.50 - F1: 0.4223
2026-02-13 19:54:31 - INFO - Time taken for Epoch 22:3.35 - F1: 0.5116
2026-02-13 19:54:34 - INFO - Time taken for Epoch 23:3.36 - F1: 0.5097
2026-02-13 19:54:38 - INFO - Time taken for Epoch 24:3.36 - F1: 0.4198
2026-02-13 19:54:38 - INFO - Performance not improving for 10 consecutive epochs.
2026-02-13 19:54:38 - INFO - Best F1:0.5278 - Best Epoch:13
2026-02-13 19:54:43 - INFO - 

Hf Model: GPT-4o PLM: bert-tweet Dataset: humanitarian10, NumShots: 25, N: 25 Test SEED: 1234 F1: 0.5217, Test ECE: 0.1456
2026-02-13 19:54:43 - INFO - All results: {'f1_macro': 0.5217358704252324, 'ece': np.float64(0.14558427161259815)}
2026-02-13 19:54:43 - INFO - 
Total time taken: 927.31 seconds
2026-02-13 19:54:43 - INFO - Trial 3 finished with value: 0.5217358704252324 and parameters: {'learning_rate': 0.00011129491702763256, 'weight_decay': 0.006505955700945937, 'batch_size': 8, 'co_train_epochs': 20, 'epoch_patience': 6}. Best is trial 1 with value: 0.6332674015130351.
2026-02-13 19:54:43 - INFO - Using devices: cuda, cuda
2026-02-13 19:54:43 - INFO - Devices: cuda, cuda
2026-02-13 19:54:43 - INFO - Starting log
2026-02-13 19:54:43 - INFO - Dataset: humanitarian10, Event: california_wildfires_2018, N: 25, Seed: 1234, HF Model: GPT-4o, NumShots: 25, PLM: bert-tweet
2026-02-13 19:54:44 - INFO - Learning Rate: 0.00017493417686865716
Weight Decay: 0.0004719146810401247
Batch Size: 24
No. Epochs: 15
Epoch Patience: 4
 Accumulation Steps: 2
2026-02-13 19:54:44 - INFO - Generating initial weights
2026-02-13 19:55:00 - INFO - Time taken for Epoch 1:13.91 - F1: 0.0368
2026-02-13 19:55:13 - INFO - Time taken for Epoch 2:13.89 - F1: 0.0841
2026-02-13 19:55:27 - INFO - Time taken for Epoch 3:13.90 - F1: 0.1216
2026-02-13 19:55:41 - INFO - Time taken for Epoch 4:14.00 - F1: 0.0952
2026-02-13 19:55:56 - INFO - Time taken for Epoch 5:14.28 - F1: 0.1134
2026-02-13 19:56:10 - INFO - Time taken for Epoch 6:14.32 - F1: 0.1180
2026-02-13 19:56:24 - INFO - Time taken for Epoch 7:14.10 - F1: 0.1562
2026-02-13 19:56:38 - INFO - Time taken for Epoch 8:14.23 - F1: 0.3036
2026-02-13 19:56:53 - INFO - Time taken for Epoch 9:14.25 - F1: 0.3557
2026-02-13 19:57:07 - INFO - Time taken for Epoch 10:14.12 - F1: 0.3996
2026-02-13 19:57:21 - INFO - Time taken for Epoch 11:14.27 - F1: 0.3842
2026-02-13 19:57:35 - INFO - Time taken for Epoch 12:14.03 - F1: 0.4072
2026-02-13 19:57:49 - INFO - Time taken for Epoch 13:13.92 - F1: 0.4667
2026-02-13 19:58:03 - INFO - Time taken for Epoch 14:14.08 - F1: 0.4224
2026-02-13 19:58:17 - INFO - Time taken for Epoch 15:13.96 - F1: 0.4578
2026-02-13 19:58:17 - INFO - Best F1:0.4667 - Best Epoch:13
2026-02-13 19:58:18 - INFO - Starting co-training
2026-02-13 19:58:47 - INFO - Time taken for Epoch 1: 29.13s - F1: 0.34228568
2026-02-13 19:59:16 - INFO - Time taken for Epoch 2: 29.42s - F1: 0.42014935
2026-02-13 19:59:46 - INFO - Time taken for Epoch 3: 29.33s - F1: 0.39019848
2026-02-13 20:00:15 - INFO - Time taken for Epoch 4: 28.72s - F1: 0.48301210
2026-02-13 20:00:44 - INFO - Time taken for Epoch 5: 29.38s - F1: 0.40455290
2026-02-13 20:01:13 - INFO - Time taken for Epoch 6: 29.36s - F1: 0.45137714
2026-02-13 20:01:42 - INFO - Time taken for Epoch 7: 28.75s - F1: 0.42538168
2026-02-13 20:02:11 - INFO - Time taken for Epoch 8: 29.26s - F1: 0.48354624
2026-02-13 20:02:41 - INFO - Time taken for Epoch 9: 29.37s - F1: 0.46947654
2026-02-13 20:03:10 - INFO - Time taken for Epoch 10: 29.02s - F1: 0.42812980
2026-02-13 20:03:38 - INFO - Time taken for Epoch 11: 28.74s - F1: 0.51214558
2026-02-13 20:04:08 - INFO - Time taken for Epoch 12: 29.31s - F1: 0.46842228
2026-02-13 20:04:36 - INFO - Time taken for Epoch 13: 28.55s - F1: 0.49325605
2026-02-13 20:05:05 - INFO - Time taken for Epoch 14: 28.81s - F1: 0.49933286
2026-02-13 20:05:34 - INFO - Time taken for Epoch 15: 28.63s - F1: 0.47913608
2026-02-13 20:05:35 - INFO - Fine-tuning models
2026-02-13 20:05:38 - INFO - Time taken for Epoch 1:2.75 - F1: 0.4597
2026-02-13 20:05:41 - INFO - Time taken for Epoch 2:3.33 - F1: 0.4827
2026-02-13 20:05:45 - INFO - Time taken for Epoch 3:3.32 - F1: 0.4429
2026-02-13 20:05:47 - INFO - Time taken for Epoch 4:2.70 - F1: 0.4401
2026-02-13 20:05:50 - INFO - Time taken for Epoch 5:2.69 - F1: 0.5135
2026-02-13 20:05:53 - INFO - Time taken for Epoch 6:3.37 - F1: 0.5031
2026-02-13 20:05:56 - INFO - Time taken for Epoch 7:2.69 - F1: 0.4151
2026-02-13 20:05:59 - INFO - Time taken for Epoch 8:2.69 - F1: 0.4107
2026-02-13 20:06:02 - INFO - Time taken for Epoch 9:2.69 - F1: 0.4848
2026-02-13 20:06:04 - INFO - Time taken for Epoch 10:2.70 - F1: 0.4622
2026-02-13 20:06:07 - INFO - Time taken for Epoch 11:2.69 - F1: 0.4707
2026-02-13 20:06:10 - INFO - Time taken for Epoch 12:2.69 - F1: 0.4693
2026-02-13 20:06:12 - INFO - Time taken for Epoch 13:2.70 - F1: 0.4318
2026-02-13 20:06:15 - INFO - Time taken for Epoch 14:2.70 - F1: 0.4493
2026-02-13 20:06:21 - INFO - Time taken for Epoch 15:5.96 - F1: 0.3917
2026-02-13 20:06:21 - INFO - Performance not improving for 10 consecutive epochs.
2026-02-13 20:06:21 - INFO - Best F1:0.5135 - Best Epoch:4
2026-02-13 20:06:26 - INFO - 

Hf Model: GPT-4o PLM: bert-tweet Dataset: humanitarian10, NumShots: 25, N: 25 Test SEED: 1234 F1: 0.4966, Test ECE: 0.1316
2026-02-13 20:06:26 - INFO - All results: {'f1_macro': 0.49658510304954007, 'ece': np.float64(0.1316203969052032)}
2026-02-13 20:06:26 - INFO - 
Total time taken: 702.50 seconds
2026-02-13 20:06:26 - INFO - Trial 4 finished with value: 0.49658510304954007 and parameters: {'learning_rate': 0.00017493417686865716, 'weight_decay': 0.0004719146810401247, 'batch_size': 24, 'co_train_epochs': 15, 'epoch_patience': 4}. Best is trial 1 with value: 0.6332674015130351.
2026-02-13 20:06:26 - INFO - Using devices: cuda, cuda
2026-02-13 20:06:26 - INFO - Devices: cuda, cuda
2026-02-13 20:06:26 - INFO - Starting log
2026-02-13 20:06:26 - INFO - Dataset: humanitarian10, Event: california_wildfires_2018, N: 25, Seed: 1234, HF Model: GPT-4o, NumShots: 25, PLM: bert-tweet
2026-02-13 20:06:26 - INFO - Learning Rate: 0.0006414220348554964
Weight Decay: 0.0004840248721449105
Batch Size: 8
No. Epochs: 10
Epoch Patience: 5
 Accumulation Steps: 8
2026-02-13 20:06:27 - INFO - Generating initial weights
2026-02-13 20:06:45 - INFO - Time taken for Epoch 1:17.21 - F1: 0.0099
2026-02-13 20:07:03 - INFO - Time taken for Epoch 2:17.11 - F1: 0.0047
2026-02-13 20:07:20 - INFO - Time taken for Epoch 3:17.15 - F1: 0.0321
2026-02-13 20:07:37 - INFO - Time taken for Epoch 4:17.22 - F1: 0.0321
2026-02-13 20:07:54 - INFO - Time taken for Epoch 5:17.21 - F1: 0.0321
2026-02-13 20:08:11 - INFO - Time taken for Epoch 6:17.03 - F1: 0.0247
2026-02-13 20:08:28 - INFO - Time taken for Epoch 7:17.03 - F1: 0.0247
2026-02-13 20:08:45 - INFO - Time taken for Epoch 8:17.06 - F1: 0.0321
2026-02-13 20:09:02 - INFO - Time taken for Epoch 9:17.04 - F1: 0.0321
2026-02-13 20:09:19 - INFO - Time taken for Epoch 10:17.07 - F1: 0.0321
2026-02-13 20:09:19 - INFO - Best F1:0.0321 - Best Epoch:3
2026-02-13 20:09:20 - INFO - Starting co-training
2026-02-13 20:09:44 - INFO - Time taken for Epoch 1: 23.44s - F1: 0.04185068
2026-02-13 20:10:08 - INFO - Time taken for Epoch 2: 24.16s - F1: 0.03024831
2026-02-13 20:10:31 - INFO - Time taken for Epoch 3: 23.43s - F1: 0.03024831
2026-02-13 20:10:55 - INFO - Time taken for Epoch 4: 23.41s - F1: 0.03024831
2026-02-13 20:11:18 - INFO - Time taken for Epoch 5: 23.38s - F1: 0.03024831
2026-02-13 20:11:42 - INFO - Time taken for Epoch 6: 23.39s - F1: 0.03024831
2026-02-13 20:11:42 - INFO - Performance not improving for 5 consecutive epochs.
2026-02-13 20:11:43 - INFO - Fine-tuning models
2026-02-13 20:11:47 - INFO - Time taken for Epoch 1:3.36 - F1: 0.0096
2026-02-13 20:11:51 - INFO - Time taken for Epoch 2:4.20 - F1: 0.0037
2026-02-13 20:11:54 - INFO - Time taken for Epoch 3:3.34 - F1: 0.0037
2026-02-13 20:11:57 - INFO - Time taken for Epoch 4:3.37 - F1: 0.0108
2026-02-13 20:12:02 - INFO - Time taken for Epoch 5:4.16 - F1: 0.0108
2026-02-13 20:12:05 - INFO - Time taken for Epoch 6:3.34 - F1: 0.0047
2026-02-13 20:12:08 - INFO - Time taken for Epoch 7:3.34 - F1: 0.0047
2026-02-13 20:12:12 - INFO - Time taken for Epoch 8:3.34 - F1: 0.0096
2026-02-13 20:12:15 - INFO - Time taken for Epoch 9:3.35 - F1: 0.0096
2026-02-13 20:12:18 - INFO - Time taken for Epoch 10:3.35 - F1: 0.0096
2026-02-13 20:12:22 - INFO - Time taken for Epoch 11:3.35 - F1: 0.0096
2026-02-13 20:12:25 - INFO - Time taken for Epoch 12:3.35 - F1: 0.0037
2026-02-13 20:12:28 - INFO - Time taken for Epoch 13:3.36 - F1: 0.0037
2026-02-13 20:12:32 - INFO - Time taken for Epoch 14:3.35 - F1: 0.0108
2026-02-13 20:12:32 - INFO - Performance not improving for 10 consecutive epochs.
2026-02-13 20:12:32 - INFO - Best F1:0.0108 - Best Epoch:3
2026-02-13 20:12:37 - INFO - 

Hf Model: GPT-4o PLM: bert-tweet Dataset: humanitarian10, NumShots: 25, N: 25 Test SEED: 1234 F1: 0.0109, Test ECE: 0.2491
2026-02-13 20:12:37 - INFO - All results: {'f1_macro': 0.01087378640776699, 'ece': np.float64(0.24913230460853628)}
2026-02-13 20:12:37 - INFO - 
Total time taken: 371.57 seconds
2026-02-13 20:12:37 - INFO - Trial 5 finished with value: 0.01087378640776699 and parameters: {'learning_rate': 0.0006414220348554964, 'weight_decay': 0.0004840248721449105, 'batch_size': 8, 'co_train_epochs': 10, 'epoch_patience': 5}. Best is trial 1 with value: 0.6332674015130351.
2026-02-13 20:12:37 - INFO - Using devices: cuda, cuda
2026-02-13 20:12:37 - INFO - Devices: cuda, cuda
2026-02-13 20:12:37 - INFO - Starting log
2026-02-13 20:12:37 - INFO - Dataset: humanitarian10, Event: california_wildfires_2018, N: 25, Seed: 1234, HF Model: GPT-4o, NumShots: 25, PLM: bert-tweet
2026-02-13 20:12:38 - INFO - Learning Rate: 0.0007064087139132851
Weight Decay: 1.7366656317433533e-05
Batch Size: 16
No. Epochs: 9
Epoch Patience: 7
 Accumulation Steps: 4
2026-02-13 20:12:38 - INFO - Generating initial weights
2026-02-13 20:12:55 - INFO - Time taken for Epoch 1:14.98 - F1: 0.0240
2026-02-13 20:13:10 - INFO - Time taken for Epoch 2:14.91 - F1: 0.0047
2026-02-13 20:13:24 - INFO - Time taken for Epoch 3:14.89 - F1: 0.0047
2026-02-13 20:13:39 - INFO - Time taken for Epoch 4:14.87 - F1: 0.0120
2026-02-13 20:13:54 - INFO - Time taken for Epoch 5:14.90 - F1: 0.0120
2026-02-13 20:14:09 - INFO - Time taken for Epoch 6:14.89 - F1: 0.0120
2026-02-13 20:14:24 - INFO - Time taken for Epoch 7:14.90 - F1: 0.0120
2026-02-13 20:14:39 - INFO - Time taken for Epoch 8:14.90 - F1: 0.0120
2026-02-13 20:14:54 - INFO - Time taken for Epoch 9:14.90 - F1: 0.0120
2026-02-13 20:14:54 - INFO - Best F1:0.0240 - Best Epoch:1
2026-02-13 20:14:55 - INFO - Starting co-training
2026-02-13 20:15:18 - INFO - Time taken for Epoch 1: 23.74s - F1: 0.04185068
2026-02-13 20:15:43 - INFO - Time taken for Epoch 2: 24.38s - F1: 0.04185068
2026-02-13 20:16:07 - INFO - Time taken for Epoch 3: 23.73s - F1: 0.04185068
2026-02-13 20:16:30 - INFO - Time taken for Epoch 4: 23.67s - F1: 0.04185068
2026-02-13 20:16:54 - INFO - Time taken for Epoch 5: 23.65s - F1: 0.04185068
2026-02-13 20:17:18 - INFO - Time taken for Epoch 6: 23.69s - F1: 0.04185068
2026-02-13 20:17:41 - INFO - Time taken for Epoch 7: 23.67s - F1: 0.04185068
2026-02-13 20:18:05 - INFO - Time taken for Epoch 8: 23.68s - F1: 0.04185068
2026-02-13 20:18:05 - INFO - Performance not improving for 7 consecutive epochs.
2026-02-13 20:18:07 - INFO - Fine-tuning models
2026-02-13 20:18:10 - INFO - Time taken for Epoch 1:2.91 - F1: 0.0021
2026-02-13 20:18:14 - INFO - Time taken for Epoch 2:3.47 - F1: 0.0047
2026-02-13 20:18:17 - INFO - Time taken for Epoch 3:3.53 - F1: 0.0108
2026-02-13 20:18:21 - INFO - Time taken for Epoch 4:3.54 - F1: 0.0108
2026-02-13 20:18:24 - INFO - Time taken for Epoch 5:2.89 - F1: 0.0108
2026-02-13 20:18:27 - INFO - Time taken for Epoch 6:2.90 - F1: 0.0108
2026-02-13 20:18:30 - INFO - Time taken for Epoch 7:2.90 - F1: 0.0047
2026-02-13 20:18:32 - INFO - Time taken for Epoch 8:2.90 - F1: 0.0047
2026-02-13 20:18:35 - INFO - Time taken for Epoch 9:2.90 - F1: 0.0047
2026-02-13 20:18:38 - INFO - Time taken for Epoch 10:2.90 - F1: 0.0419
2026-02-13 20:18:42 - INFO - Time taken for Epoch 11:3.55 - F1: 0.0419
2026-02-13 20:18:45 - INFO - Time taken for Epoch 12:2.91 - F1: 0.0419
2026-02-13 20:18:48 - INFO - Time taken for Epoch 13:2.91 - F1: 0.0419
2026-02-13 20:18:53 - INFO - Time taken for Epoch 14:5.05 - F1: 0.0108
2026-02-13 20:18:56 - INFO - Time taken for Epoch 15:2.90 - F1: 0.0047
2026-02-13 20:18:58 - INFO - Time taken for Epoch 16:2.89 - F1: 0.0047
2026-02-13 20:19:01 - INFO - Time taken for Epoch 17:2.90 - F1: 0.0047
2026-02-13 20:19:04 - INFO - Time taken for Epoch 18:2.89 - F1: 0.0047
2026-02-13 20:19:07 - INFO - Time taken for Epoch 19:2.89 - F1: 0.0108
2026-02-13 20:19:10 - INFO - Time taken for Epoch 20:2.90 - F1: 0.0096
2026-02-13 20:19:10 - INFO - Performance not improving for 10 consecutive epochs.
2026-02-13 20:19:10 - INFO - Best F1:0.0419 - Best Epoch:9
2026-02-13 20:19:15 - INFO - 

Hf Model: GPT-4o PLM: bert-tweet Dataset: humanitarian10, NumShots: 25, N: 25 Test SEED: 1234 F1: 0.0417, Test ECE: 0.0264
2026-02-13 20:19:15 - INFO - All results: {'f1_macro': 0.04171180931744312, 'ece': np.float64(0.026405424450783588)}
2026-02-13 20:19:15 - INFO - 
Total time taken: 397.73 seconds
2026-02-13 20:19:15 - INFO - Trial 6 finished with value: 0.04171180931744312 and parameters: {'learning_rate': 0.0007064087139132851, 'weight_decay': 1.7366656317433533e-05, 'batch_size': 16, 'co_train_epochs': 9, 'epoch_patience': 7}. Best is trial 1 with value: 0.6332674015130351.
2026-02-13 20:19:15 - INFO - Using devices: cuda, cuda
2026-02-13 20:19:15 - INFO - Devices: cuda, cuda
2026-02-13 20:19:15 - INFO - Starting log
2026-02-13 20:19:15 - INFO - Dataset: humanitarian10, Event: california_wildfires_2018, N: 25, Seed: 1234, HF Model: GPT-4o, NumShots: 25, PLM: bert-tweet
2026-02-13 20:19:16 - INFO - Learning Rate: 5.980014537864447e-05
Weight Decay: 0.004443145267003231
Batch Size: 24
No. Epochs: 10
Epoch Patience: 9
 Accumulation Steps: 2
2026-02-13 20:19:16 - INFO - Generating initial weights
2026-02-13 20:19:31 - INFO - Time taken for Epoch 1:13.92 - F1: 0.0732
2026-02-13 20:19:45 - INFO - Time taken for Epoch 2:13.90 - F1: 0.0818
2026-02-13 20:19:59 - INFO - Time taken for Epoch 3:13.88 - F1: 0.0975
2026-02-13 20:20:13 - INFO - Time taken for Epoch 4:13.90 - F1: 0.1511
2026-02-13 20:20:27 - INFO - Time taken for Epoch 5:13.88 - F1: 0.2051
2026-02-13 20:20:41 - INFO - Time taken for Epoch 6:13.87 - F1: 0.2516
2026-02-13 20:20:55 - INFO - Time taken for Epoch 7:13.87 - F1: 0.3089
2026-02-13 20:21:08 - INFO - Time taken for Epoch 8:13.87 - F1: 0.3501
2026-02-13 20:21:22 - INFO - Time taken for Epoch 9:13.85 - F1: 0.3973
2026-02-13 20:21:36 - INFO - Time taken for Epoch 10:13.86 - F1: 0.4343
2026-02-13 20:21:36 - INFO - Best F1:0.4343 - Best Epoch:10
2026-02-13 20:21:37 - INFO - Starting co-training
2026-02-13 20:22:06 - INFO - Time taken for Epoch 1: 28.44s - F1: 0.44976632
2026-02-13 20:22:35 - INFO - Time taken for Epoch 2: 29.08s - F1: 0.45148559
2026-02-13 20:23:04 - INFO - Time taken for Epoch 3: 29.09s - F1: 0.55244467
2026-02-13 20:23:33 - INFO - Time taken for Epoch 4: 29.21s - F1: 0.57818107
2026-02-13 20:24:02 - INFO - Time taken for Epoch 5: 29.11s - F1: 0.59946227
2026-02-13 20:24:31 - INFO - Time taken for Epoch 6: 29.17s - F1: 0.60871231
2026-02-13 20:25:01 - INFO - Time taken for Epoch 7: 29.49s - F1: 0.61429309
2026-02-13 20:25:30 - INFO - Time taken for Epoch 8: 29.06s - F1: 0.62303521
2026-02-13 20:25:59 - INFO - Time taken for Epoch 9: 29.21s - F1: 0.60426452
2026-02-13 20:26:27 - INFO - Time taken for Epoch 10: 28.41s - F1: 0.60747351
2026-02-13 20:26:29 - INFO - Fine-tuning models
2026-02-13 20:26:32 - INFO - Time taken for Epoch 1:2.73 - F1: 0.5745
2026-02-13 20:26:36 - INFO - Time taken for Epoch 2:3.89 - F1: 0.5706
2026-02-13 20:26:38 - INFO - Time taken for Epoch 3:2.67 - F1: 0.5829
2026-02-13 20:26:42 - INFO - Time taken for Epoch 4:3.64 - F1: 0.5982
2026-02-13 20:26:46 - INFO - Time taken for Epoch 5:3.46 - F1: 0.6029
2026-02-13 20:26:49 - INFO - Time taken for Epoch 6:3.56 - F1: 0.5997
2026-02-13 20:26:52 - INFO - Time taken for Epoch 7:2.67 - F1: 0.6059
2026-02-13 20:26:55 - INFO - Time taken for Epoch 8:3.65 - F1: 0.6165
2026-02-13 20:26:59 - INFO - Time taken for Epoch 9:3.56 - F1: 0.6105
2026-02-13 20:27:02 - INFO - Time taken for Epoch 10:2.67 - F1: 0.6090
2026-02-13 20:27:04 - INFO - Time taken for Epoch 11:2.67 - F1: 0.5948
2026-02-13 20:27:07 - INFO - Time taken for Epoch 12:2.69 - F1: 0.6153
2026-02-13 20:27:10 - INFO - Time taken for Epoch 13:2.69 - F1: 0.6207
2026-02-13 20:27:17 - INFO - Time taken for Epoch 14:6.91 - F1: 0.6196
2026-02-13 20:27:19 - INFO - Time taken for Epoch 15:2.67 - F1: 0.6163
2026-02-13 20:27:22 - INFO - Time taken for Epoch 16:2.67 - F1: 0.6151
2026-02-13 20:27:25 - INFO - Time taken for Epoch 17:2.67 - F1: 0.6172
2026-02-13 20:27:27 - INFO - Time taken for Epoch 18:2.68 - F1: 0.6162
2026-02-13 20:27:30 - INFO - Time taken for Epoch 19:2.68 - F1: 0.6124
2026-02-13 20:27:33 - INFO - Time taken for Epoch 20:2.68 - F1: 0.6124
2026-02-13 20:27:35 - INFO - Time taken for Epoch 21:2.68 - F1: 0.6091
2026-02-13 20:27:38 - INFO - Time taken for Epoch 22:2.68 - F1: 0.6112
2026-02-13 20:27:41 - INFO - Time taken for Epoch 23:2.67 - F1: 0.6112
2026-02-13 20:27:41 - INFO - Performance not improving for 10 consecutive epochs.
2026-02-13 20:27:41 - INFO - Best F1:0.6207 - Best Epoch:12
2026-02-13 20:27:46 - INFO - 

Hf Model: GPT-4o PLM: bert-tweet Dataset: humanitarian10, NumShots: 25, N: 25 Test SEED: 1234 F1: 0.6146, Test ECE: 0.0602
2026-02-13 20:27:46 - INFO - All results: {'f1_macro': 0.6145753712822251, 'ece': np.float64(0.06024344052295828)}
2026-02-13 20:27:46 - INFO - 
Total time taken: 510.41 seconds
2026-02-13 20:27:46 - INFO - Trial 7 finished with value: 0.6145753712822251 and parameters: {'learning_rate': 5.980014537864447e-05, 'weight_decay': 0.004443145267003231, 'batch_size': 24, 'co_train_epochs': 10, 'epoch_patience': 9}. Best is trial 1 with value: 0.6332674015130351.
2026-02-13 20:27:46 - INFO - Using devices: cuda, cuda
2026-02-13 20:27:46 - INFO - Devices: cuda, cuda
2026-02-13 20:27:46 - INFO - Starting log
2026-02-13 20:27:46 - INFO - Dataset: humanitarian10, Event: california_wildfires_2018, N: 25, Seed: 1234, HF Model: GPT-4o, NumShots: 25, PLM: bert-tweet
2026-02-13 20:27:46 - INFO - Learning Rate: 1.489320666679146e-05
Weight Decay: 0.0029412202141756473
Batch Size: 24
No. Epochs: 12
Epoch Patience: 10
 Accumulation Steps: 2
2026-02-13 20:27:47 - INFO - Generating initial weights
2026-02-13 20:28:02 - INFO - Time taken for Epoch 1:13.93 - F1: 0.0550
2026-02-13 20:28:16 - INFO - Time taken for Epoch 2:13.89 - F1: 0.0606
2026-02-13 20:28:30 - INFO - Time taken for Epoch 3:13.88 - F1: 0.0685
2026-02-13 20:28:43 - INFO - Time taken for Epoch 4:13.83 - F1: 0.0756
2026-02-13 20:28:57 - INFO - Time taken for Epoch 5:13.89 - F1: 0.0818
2026-02-13 20:29:11 - INFO - Time taken for Epoch 6:13.87 - F1: 0.0855
2026-02-13 20:29:25 - INFO - Time taken for Epoch 7:13.89 - F1: 0.1197
2026-02-13 20:29:39 - INFO - Time taken for Epoch 8:13.89 - F1: 0.1753
2026-02-13 20:29:53 - INFO - Time taken for Epoch 9:13.88 - F1: 0.2012
2026-02-13 20:30:07 - INFO - Time taken for Epoch 10:13.86 - F1: 0.2205
2026-02-13 20:30:21 - INFO - Time taken for Epoch 11:13.88 - F1: 0.2304
2026-02-13 20:30:34 - INFO - Time taken for Epoch 12:13.88 - F1: 0.2359
2026-02-13 20:30:34 - INFO - Best F1:0.2359 - Best Epoch:12
2026-02-13 20:30:35 - INFO - Starting co-training
2026-02-13 20:31:04 - INFO - Time taken for Epoch 1: 28.43s - F1: 0.27748008
2026-02-13 20:31:33 - INFO - Time taken for Epoch 2: 29.33s - F1: 0.42506492
2026-02-13 20:32:02 - INFO - Time taken for Epoch 3: 29.06s - F1: 0.43156509
2026-02-13 20:32:32 - INFO - Time taken for Epoch 4: 29.38s - F1: 0.48000124
2026-02-13 20:33:01 - INFO - Time taken for Epoch 5: 29.18s - F1: 0.49012361
2026-02-13 20:33:30 - INFO - Time taken for Epoch 6: 29.04s - F1: 0.56362331
2026-02-13 20:33:59 - INFO - Time taken for Epoch 7: 29.25s - F1: 0.59318648
2026-02-13 20:34:28 - INFO - Time taken for Epoch 8: 29.05s - F1: 0.58470964
2026-02-13 20:34:57 - INFO - Time taken for Epoch 9: 28.44s - F1: 0.59944235
2026-02-13 20:35:26 - INFO - Time taken for Epoch 10: 29.03s - F1: 0.62580206
2026-02-13 20:35:55 - INFO - Time taken for Epoch 11: 29.20s - F1: 0.62705300
2026-02-13 20:36:24 - INFO - Time taken for Epoch 12: 29.34s - F1: 0.62572789
2026-02-13 20:36:26 - INFO - Fine-tuning models
2026-02-13 20:36:28 - INFO - Time taken for Epoch 1:2.73 - F1: 0.5996
2026-02-13 20:36:32 - INFO - Time taken for Epoch 2:3.71 - F1: 0.5717
2026-02-13 20:36:35 - INFO - Time taken for Epoch 3:2.68 - F1: 0.5704
2026-02-13 20:36:38 - INFO - Time taken for Epoch 4:2.69 - F1: 0.5786
2026-02-13 20:36:40 - INFO - Time taken for Epoch 5:2.68 - F1: 0.5870
2026-02-13 20:36:43 - INFO - Time taken for Epoch 6:2.68 - F1: 0.6058
2026-02-13 20:36:47 - INFO - Time taken for Epoch 7:3.67 - F1: 0.5989
2026-02-13 20:36:49 - INFO - Time taken for Epoch 8:2.68 - F1: 0.5881
2026-02-13 20:36:52 - INFO - Time taken for Epoch 9:2.68 - F1: 0.5879
2026-02-13 20:36:55 - INFO - Time taken for Epoch 10:2.68 - F1: 0.6026
2026-02-13 20:36:57 - INFO - Time taken for Epoch 11:2.68 - F1: 0.5987
2026-02-13 20:37:00 - INFO - Time taken for Epoch 12:2.68 - F1: 0.6056
2026-02-13 20:37:03 - INFO - Time taken for Epoch 13:2.68 - F1: 0.6061
2026-02-13 20:37:07 - INFO - Time taken for Epoch 14:4.69 - F1: 0.5960
2026-02-13 20:37:10 - INFO - Time taken for Epoch 15:2.68 - F1: 0.5997
2026-02-13 20:37:13 - INFO - Time taken for Epoch 16:2.68 - F1: 0.6031
2026-02-13 20:37:15 - INFO - Time taken for Epoch 17:2.68 - F1: 0.6131
2026-02-13 20:37:19 - INFO - Time taken for Epoch 18:3.33 - F1: 0.6095
2026-02-13 20:37:21 - INFO - Time taken for Epoch 19:2.68 - F1: 0.6098
2026-02-13 20:37:24 - INFO - Time taken for Epoch 20:2.68 - F1: 0.6082
2026-02-13 20:37:27 - INFO - Time taken for Epoch 21:2.68 - F1: 0.6149
2026-02-13 20:37:30 - INFO - Time taken for Epoch 22:3.73 - F1: 0.6134
2026-02-13 20:37:33 - INFO - Time taken for Epoch 23:2.67 - F1: 0.6125
2026-02-13 20:37:36 - INFO - Time taken for Epoch 24:2.68 - F1: 0.6084
2026-02-13 20:37:39 - INFO - Time taken for Epoch 25:2.68 - F1: 0.6127
2026-02-13 20:37:41 - INFO - Time taken for Epoch 26:2.68 - F1: 0.6185
2026-02-13 20:37:45 - INFO - Time taken for Epoch 27:3.35 - F1: 0.6207
2026-02-13 20:37:48 - INFO - Time taken for Epoch 28:3.34 - F1: 0.6200
2026-02-13 20:37:51 - INFO - Time taken for Epoch 29:2.68 - F1: 0.6166
2026-02-13 20:37:53 - INFO - Time taken for Epoch 30:2.69 - F1: 0.6207
2026-02-13 20:37:56 - INFO - Time taken for Epoch 31:2.68 - F1: 0.6144
2026-02-13 20:37:59 - INFO - Time taken for Epoch 32:2.68 - F1: 0.6144
2026-02-13 20:38:01 - INFO - Time taken for Epoch 33:2.68 - F1: 0.6154
2026-02-13 20:38:04 - INFO - Time taken for Epoch 34:2.68 - F1: 0.6180
2026-02-13 20:38:07 - INFO - Time taken for Epoch 35:2.68 - F1: 0.6192
2026-02-13 20:38:09 - INFO - Time taken for Epoch 36:2.68 - F1: 0.6191
2026-02-13 20:38:12 - INFO - Time taken for Epoch 37:2.68 - F1: 0.6177
2026-02-13 20:38:12 - INFO - Performance not improving for 10 consecutive epochs.
2026-02-13 20:38:12 - INFO - Best F1:0.6207 - Best Epoch:26
2026-02-13 20:38:17 - INFO - 

Hf Model: GPT-4o PLM: bert-tweet Dataset: humanitarian10, NumShots: 25, N: 25 Test SEED: 1234 F1: 0.6430, Test ECE: 0.0325
2026-02-13 20:38:17 - INFO - All results: {'f1_macro': 0.6430335540080823, 'ece': np.float64(0.03249400654204654)}
2026-02-13 20:38:17 - INFO - 
Total time taken: 631.25 seconds
2026-02-13 20:38:17 - INFO - Trial 8 finished with value: 0.6430335540080823 and parameters: {'learning_rate': 1.489320666679146e-05, 'weight_decay': 0.0029412202141756473, 'batch_size': 24, 'co_train_epochs': 12, 'epoch_patience': 10}. Best is trial 8 with value: 0.6430335540080823.
2026-02-13 20:38:17 - INFO - Using devices: cuda, cuda
2026-02-13 20:38:17 - INFO - Devices: cuda, cuda
2026-02-13 20:38:17 - INFO - Starting log
2026-02-13 20:38:17 - INFO - Dataset: humanitarian10, Event: california_wildfires_2018, N: 25, Seed: 1234, HF Model: GPT-4o, NumShots: 25, PLM: bert-tweet
2026-02-13 20:38:17 - INFO - Learning Rate: 2.3160434552219524e-05
Weight Decay: 1.107576258966482e-05
Batch Size: 24
No. Epochs: 15
Epoch Patience: 4
 Accumulation Steps: 2
2026-02-13 20:38:18 - INFO - Generating initial weights
2026-02-13 20:38:33 - INFO - Time taken for Epoch 1:13.93 - F1: 0.0575
2026-02-13 20:38:47 - INFO - Time taken for Epoch 2:13.88 - F1: 0.0700
2026-02-13 20:39:01 - INFO - Time taken for Epoch 3:13.87 - F1: 0.0807
2026-02-13 20:39:15 - INFO - Time taken for Epoch 4:13.87 - F1: 0.0871
2026-02-13 20:39:29 - INFO - Time taken for Epoch 5:13.89 - F1: 0.0979
2026-02-13 20:39:42 - INFO - Time taken for Epoch 6:13.88 - F1: 0.1722
2026-02-13 20:39:56 - INFO - Time taken for Epoch 7:13.88 - F1: 0.2076
2026-02-13 20:40:10 - INFO - Time taken for Epoch 8:13.85 - F1: 0.2327
2026-02-13 20:40:24 - INFO - Time taken for Epoch 9:13.88 - F1: 0.2749
2026-02-13 20:40:38 - INFO - Time taken for Epoch 10:13.88 - F1: 0.3237
2026-02-13 20:40:52 - INFO - Time taken for Epoch 11:13.88 - F1: 0.3359
2026-02-13 20:41:06 - INFO - Time taken for Epoch 12:13.86 - F1: 0.3728
2026-02-13 20:41:19 - INFO - Time taken for Epoch 13:13.87 - F1: 0.3816
2026-02-13 20:41:33 - INFO - Time taken for Epoch 14:13.87 - F1: 0.4076
2026-02-13 20:41:47 - INFO - Time taken for Epoch 15:13.86 - F1: 0.4061
2026-02-13 20:41:47 - INFO - Best F1:0.4076 - Best Epoch:14
2026-02-13 20:41:48 - INFO - Starting co-training
2026-02-13 20:42:17 - INFO - Time taken for Epoch 1: 28.44s - F1: 0.39682801
2026-02-13 20:42:45 - INFO - Time taken for Epoch 2: 28.99s - F1: 0.42461261
2026-02-13 20:43:15 - INFO - Time taken for Epoch 3: 29.08s - F1: 0.48020459
2026-02-13 20:43:44 - INFO - Time taken for Epoch 4: 29.32s - F1: 0.52812600
2026-02-13 20:44:13 - INFO - Time taken for Epoch 5: 29.12s - F1: 0.53151294
2026-02-13 20:44:42 - INFO - Time taken for Epoch 6: 29.09s - F1: 0.58369598
2026-02-13 20:45:11 - INFO - Time taken for Epoch 7: 29.17s - F1: 0.59615308
2026-02-13 20:45:40 - INFO - Time taken for Epoch 8: 29.09s - F1: 0.59988327
2026-02-13 20:46:09 - INFO - Time taken for Epoch 9: 29.11s - F1: 0.63777093
2026-02-13 20:46:39 - INFO - Time taken for Epoch 10: 29.23s - F1: 0.59517903
2026-02-13 20:47:07 - INFO - Time taken for Epoch 11: 28.59s - F1: 0.61602976
2026-02-13 20:47:36 - INFO - Time taken for Epoch 12: 28.42s - F1: 0.64483064
2026-02-13 20:48:05 - INFO - Time taken for Epoch 13: 29.05s - F1: 0.65833842
2026-02-13 20:48:34 - INFO - Time taken for Epoch 14: 29.31s - F1: 0.62274795
2026-02-13 20:49:02 - INFO - Time taken for Epoch 15: 28.44s - F1: 0.62569848
2026-02-13 20:49:04 - INFO - Fine-tuning models
2026-02-13 20:49:07 - INFO - Time taken for Epoch 1:2.69 - F1: 0.5934
2026-02-13 20:49:11 - INFO - Time taken for Epoch 2:3.49 - F1: 0.5768
2026-02-13 20:49:13 - INFO - Time taken for Epoch 3:2.68 - F1: 0.5873
2026-02-13 20:49:16 - INFO - Time taken for Epoch 4:2.69 - F1: 0.5837
2026-02-13 20:49:19 - INFO - Time taken for Epoch 5:2.68 - F1: 0.5893
2026-02-13 20:49:21 - INFO - Time taken for Epoch 6:2.68 - F1: 0.5990
2026-02-13 20:49:25 - INFO - Time taken for Epoch 7:4.02 - F1: 0.5921
2026-02-13 20:49:28 - INFO - Time taken for Epoch 8:2.67 - F1: 0.5951
2026-02-13 20:49:31 - INFO - Time taken for Epoch 9:2.68 - F1: 0.5881
2026-02-13 20:49:33 - INFO - Time taken for Epoch 10:2.68 - F1: 0.5887
2026-02-13 20:49:36 - INFO - Time taken for Epoch 11:2.68 - F1: 0.5986
2026-02-13 20:49:39 - INFO - Time taken for Epoch 12:2.68 - F1: 0.5884
2026-02-13 20:49:41 - INFO - Time taken for Epoch 13:2.68 - F1: 0.5933
2026-02-13 20:49:44 - INFO - Time taken for Epoch 14:2.69 - F1: 0.5908
2026-02-13 20:49:47 - INFO - Time taken for Epoch 15:2.68 - F1: 0.5936
2026-02-13 20:49:50 - INFO - Time taken for Epoch 16:2.69 - F1: 0.6028
2026-02-13 20:49:54 - INFO - Time taken for Epoch 17:4.08 - F1: 0.6002
2026-02-13 20:49:56 - INFO - Time taken for Epoch 18:2.67 - F1: 0.6070
2026-02-13 20:50:00 - INFO - Time taken for Epoch 19:3.29 - F1: 0.5979
2026-02-13 20:50:02 - INFO - Time taken for Epoch 20:2.67 - F1: 0.5980
2026-02-13 20:50:05 - INFO - Time taken for Epoch 21:2.68 - F1: 0.5986
2026-02-13 20:50:08 - INFO - Time taken for Epoch 22:2.68 - F1: 0.5990
2026-02-13 20:50:10 - INFO - Time taken for Epoch 23:2.68 - F1: 0.5992
2026-02-13 20:50:13 - INFO - Time taken for Epoch 24:2.68 - F1: 0.5999
2026-02-13 20:50:16 - INFO - Time taken for Epoch 25:2.68 - F1: 0.6035
2026-02-13 20:50:18 - INFO - Time taken for Epoch 26:2.68 - F1: 0.6022
2026-02-13 20:50:21 - INFO - Time taken for Epoch 27:2.68 - F1: 0.6044
2026-02-13 20:50:24 - INFO - Time taken for Epoch 28:2.68 - F1: 0.5998
2026-02-13 20:50:24 - INFO - Performance not improving for 10 consecutive epochs.
2026-02-13 20:50:24 - INFO - Best F1:0.6070 - Best Epoch:17
2026-02-13 20:50:29 - INFO - 

Hf Model: GPT-4o PLM: bert-tweet Dataset: humanitarian10, NumShots: 25, N: 25 Test SEED: 1234 F1: 0.6486, Test ECE: 0.0396
2026-02-13 20:50:29 - INFO - All results: {'f1_macro': 0.6485641135272144, 'ece': np.float64(0.03960347840591786)}
2026-02-13 20:50:29 - INFO - 
Total time taken: 731.69 seconds
2026-02-13 20:50:29 - INFO - Trial 9 finished with value: 0.6485641135272144 and parameters: {'learning_rate': 2.3160434552219524e-05, 'weight_decay': 1.107576258966482e-05, 'batch_size': 24, 'co_train_epochs': 15, 'epoch_patience': 4}. Best is trial 9 with value: 0.6485641135272144.
2026-02-13 20:50:29 - INFO - 
[BEST TRIAL RESULTS]
2026-02-13 20:50:29 - INFO - F1 Score: 0.6486
2026-02-13 20:50:29 - INFO - Params: {'learning_rate': 2.3160434552219524e-05, 'weight_decay': 1.107576258966482e-05, 'batch_size': 24, 'co_train_epochs': 15, 'epoch_patience': 4}
2026-02-13 20:50:29 - INFO -   learning_rate: 2.3160434552219524e-05
2026-02-13 20:50:29 - INFO -   weight_decay: 1.107576258966482e-05
2026-02-13 20:50:29 - INFO -   batch_size: 24
2026-02-13 20:50:29 - INFO -   co_train_epochs: 15
2026-02-13 20:50:29 - INFO -   epoch_patience: 4
2026-02-13 20:50:29 - INFO - 
Total time taken: 6037.41 seconds
